Symbol,Name,Last Sale,Net Change,% Change,Market Cap,Country,IPO Year,Volume,Sector,Industry
CURIW,CuriosityStream Inc. Warrant,$8.17 ,0.95,13.16%,0,United States,2020,305091,Consumer Services,Movies/Entertainment
CURO,CURO Group Holdings Corp. Common Stock,$15.90 ,0.29,1.86%,650073297,,2017,342549,Finance,Finance: Consumer Services
CUTR,Cutera Inc. Common Stock,$32.88 ,0.01,0.03%,579761499,United States,2004,170323,Health Care,Biotechnology: Electromedical & Electrotherapeutic Apparatus
CUZ,Cousins Properties Incorporated Common Stock,$34.17 ,0.5,1.49%,5076516280,United States,,1473746,Consumer Services,Real Estate Investment Trusts
CVA,Covanta Holding Corporation Common Stock,$14.93 ,-0.36,-2.35%,1970487901,United States,,794008,Basic Industries,Electric Utilities: Central
CVAC,CureVac N.V. Ordinary Shares,$113.00 ,-3.96,-3.39%,21121223240,Germany,2020,1226129,Health Care,Major Pharmaceuticals
CVBF,CVB Financial Corporation Common Stock,$21.12 ,0,0.00%,2861878378,United States,,588235,Finance,Major Banks
CVCO,Cavco Industries Inc. Common Stock When Issued,$215.00 ,-10.2,-4.53%,1976330955,United States,,33780,Basic Industries,Homebuilding
CVCY,Central Valley Community Bancorp Common Stock,$16.73 ,0.35,2.14%,209289757,United States,,15504,Finance,Major Banks
CVE,Cenovus Energy Inc Common Stock,$6.94 ,0.19,2.82%,14000672068,Canada,,16949574,Energy,Oil & Gas Production
CVEO,Civeo Corporation (Canada) Common Shares,$20.05 ,-0.35,-1.72%,285014138,,2014,42850,Consumer Services,Hotels/Resorts
CVET,Covetrus Inc. Common Stock,$37.58 ,-1.78,-4.52%,5101964671,United States,,389864,Health Care,Medical/Nursing Services
CVGI,Commercial Vehicle Group Inc. Common Stock,$9.40 ,-0.07,-0.74%,289853691,United States,2004,117156,Capital Goods,Auto Parts:O.E.M.
CVGW,Calavo Growers Inc. Common Stock,$76.49 ,-0.18,-0.24%,1353094179,United States,,69076,Consumer Non-Durables,Farming/Seeds/Milling
CVI,CVR Energy Inc. Common Stock,$21.12 ,1.51,7.70%,2123206251,United States,2007,768143,Energy,Integrated oil Companies
CVLB,Conversion Labs Inc. Common Stock,$30.15 ,0.92,3.15%,632920046,United States,,1160745,Basic Industries,Package Goods/Cosmetics
CVLG,Covenant Logistics Group Inc. Class A Common Stock,$18.46 ,0.25,1.37%,316297590,United States,,141416,Transportation,Trucking Freight/Courier Services
CVLT,Commvault Systems Inc. Common Stock,$69.48 ,-1.78,-2.50%,3265394360,United States,2006,448166,Technology,Computer Software: Prepackaged Software
CVLY,Codorus Valley Bancorp Inc Common Stock,$16.00 ,0.09,0.57%,157136000,United States,,36070,Finance,Savings Institutions
CVM,Cel-Sci Corporation Common Stock,$21.28 ,-2.27,-9.64%,846250293,United States,,1205822,Health Care,Biotechnology: Biological Products (No Diagnostic Substances)
CVNA,Carvana Co. Class A Common Stock,$296.25 ,0.2,0.07%,50889532898,United States,2017,1010567,Consumer Durables,Automotive Aftermarket
CVR,Chicago Rivet & Machine Co. Common Stock,$26.25 ,0.2528,0.97%,25363670,United States,,3708,Technology,Industrial Machinery/Components
CVS,CVS Health Corporation Common Stock,$70.53 ,-3.68,-4.96%,92317669014,United States,,18909705,Health Care,Medical/Nursing Services
CVU,CPI Aerostructures Inc. Common Stock,$5.04 ,-0.02,-0.40%,60234406,United States,,65661,Capital Goods,Military/Government/Technical
CVV,CVD Equipment Corporation Common Stock,$6.46 ,-0.29,-4.30%,42949297,United States,,57164,Technology,Industrial Machinery/Components
CVX,Chevron Corporation Common Stock,$93.13 ,0.58,0.63%,1.79276E+11,United States,,13966414,Energy,Integrated oil Companies
CW,Curtiss-Wright Corporation Common Stock,$115.24 ,-0.27,-0.23%,4782693476,United States,,117622,Technology,Industrial Machinery/Components
CWBC,Community West Bancshares Common Stock,$10.00 ,0.4,4.17%,84730630,United States,,4766,Finance,Major Banks
CWBR,CohBar Inc. Common Stock,$1.93 ,0.07,3.76%,117956821,United States,,1018219,Health Care,Major Pharmaceuticals
CWCO,Consolidated Water Co. Ltd. Ordinary Shares,$13.24 ,-0.06,-0.45%,200228189,Cayman Islands,,55329,Public Utilities,Water Supply
CWEN,Clearway Energy Inc. Class C Common Stock,$31.86 ,-0.7,-2.15%,6424122641,United States,2015,639690,Public Utilities,Electric Utilities: Central
CWH,Camping World Holdings Inc. Class A Commom Stock,$37.74 ,0.01,0.03%,3349668574,United States,2016,618938,Consumer Durables,Automotive Aftermarket
CWK,Cushman & Wakefield plc Ordinary Shares,$15.97 ,-0.03,-0.19%,3539424025,,2018,389895,Finance,Real Estate
CWST,Casella Waste Systems Inc. Class A Common Stock,$59.14 ,-0.56,-0.94%,2999736516,United States,1997,186341,Public Utilities,Environmental Services
CWT,California Water Service Group Common Stock,$58.11 ,-0.85,-1.44%,2896202400,United States,,122355,Public Utilities,Water Supply
CX,Cemex S.A.B. de C.V. Sponsored ADR,$6.51 ,-0.17,-2.55%,9834742502,Mexico,,11505454,Capital Goods,Building Materials
CXDC,China XD Plastics Company Limited Common Stock,$1.20 ,0.06,5.26%,84658609,China,,1498544,Capital Goods,Containers/Packaging
CXDO,Crexendo Inc. Common Stock,$6.42 ,-0.17,-2.58%,115323962,United States,,23398,Public Utilities,Telecommunications Equipment
CXE,MFS High Income Municipal Trust Common Stock,$5.16 ,-0.04,-0.77%,162651193,United States,1989,90273,,
CXH,MFS Investment Grade Municipal Trust Common Stock,$9.99 ,-0.08,-0.79%,91011348,United States,1989,18281,,
CXP,Columbia Property Trust Inc. Common Stock,$14.25 ,-0.03,-0.21%,1631126336,United States,2013,1002088,Consumer Services,Real Estate Investment Trusts
CXW,CoreCivic Inc. Common Stock,$7.62 ,-0.11,-1.42%,911641560,United States,,2621493,Consumer Services,Real Estate Investment Trusts
CYAD,Celyad Oncology SA American Depositary Shares,$8.27 ,0.13,1.60%,117476640,Belgium,2015,20985,Health Care,Major Pharmaceuticals
CYAN,Cyanotech Corporation Common Stock,$3.70 ,0.2576,7.49%,22544537,United States,,43455,Consumer Durables,Specialty Chemicals
CYBE,CyberOptics Corporation Common Stock,$28.67 ,0.69,2.47%,207991790,United States,1987,104918,Capital Goods,Electronic Components
CYBR,CyberArk Software Ltd. Ordinary Shares,$151.84 ,-10.94,-6.72%,5880970462,Israel,2014,866382,Technology,Computer Software: Prepackaged Software
CYCC,Cyclacel Pharmaceuticals Inc. Common Stock,$9.14 ,0.02,0.22%,44456814,United States,,659921,Health Care,Major Pharmaceuticals
CYCCP,Cyclacel Pharmaceuticals Inc. 6% Convertible Preferred Stock,$8.00 ,0,0.00%,0,United States,,488,Health Care,Major Pharmaceuticals
CYCN,Cyclerion Therapeutics Inc. Common Stock,$4.58 ,0.28,6.51%,155545355,United States,,409359,Health Care,Major Pharmaceuticals
CYD,China Yuchai International Limited Common Stock,$17.40 ,0.2,1.16%,710934263,Singapore,1994,48270,Energy,Industrial Machinery/Components
CYH,Community Health Systems Inc. Common Stock,$9.20 ,-0.05,-0.54%,1100512758,United States,2000,1261159,Health Care,Hospital/Nursing Management
CYRN,CYREN Ltd. Ordinary Shares,$1.34 ,0.1,8.07%,81632134,United States,,7376222,Technology,Computer Software: Prepackaged Software
CYRX,CryoPort Inc. Common Stock,$72.07 ,-1.42,-1.93%,3189298143,United States,,344602,Health Care,Major Pharmaceuticals
CYTH,Cyclo Therapeutics Inc. Common Stock,$10.70 ,0.11,1.04%,48950638,United States,,229877,Basic Industries,Major Chemicals
CYTHW,Cyclo Therapeutics Inc. Warrant,$5.44 ,-1.05,-16.18%,0,United States,,14067,Basic Industries,Major Chemicals
CYTK,Cytokinetics Incorporated Common Stock,$20.90 ,-1.23,-5.56%,1479281581,United States,2004,977575,Health Care,Major Pharmaceuticals
CZNC,Citizens & Northern Corp Common Stock,$20.73 ,-0.23,-1.10%,329855428,United States,,33947,Finance,Major Banks
CZR,Caesars Entertainment Inc. Common Stock,$78.34 ,-1.9,-2.37%,16316430991,United States,,1484777,Consumer Services,Hotels/Resorts
CZWI,Citizens Community Bancorp Inc. Common Stock,$11.20 ,0.22,2.00%,123831109,United States,,8030,Finance,Savings Institutions
CZZ,Cosan Limited Class A Common Stock,$20.84 ,-0.03,-0.14%,4655985981,Brazil,,362525,Consumer Non-Durables,Specialty Foods
D,Dominion Energy Inc. Common Stock,$71.13 ,-0.74,-1.03%,58029212227,United States,,4528442,Public Utilities,Electric Utilities: Central
DAC,Danaos Corporation Common Stock,$39.43 ,2.36,6.37%,806345117,Greece,2006,769982,Transportation,Marine Transportation
DADA,Dada Nexus Limited American Depositary Shares,$45.18 ,0.62,1.39%,10554370630,China,2020,1017182,Technology,Computer Software: Programming Data Processing
DAIO,Data I/O Corporation Common Stock,$5.89 ,0.24,4.25%,49572213,United States,1981,105441,Capital Goods,Electrical Products
DAKT,Daktronics Inc. Common Stock,$5.48 ,0.1,1.86%,246415768,United States,1994,216849,Consumer Durables,Miscellaneous manufacturing industries
DAL,Delta Air Lines Inc. Common Stock,$44.65 ,1.36,3.14%,28474836540,United States,,13746179,Transportation,Air Freight/Delivery Services
DAN,Dana Incorporated Common Stock ,$22.63 ,0.3,1.34%,3269836128,United States,,764336,Capital Goods,Auto Parts:O.E.M.
DAO,Youdao Inc. American Depositary Shares each representing one Class A Ordinary Share,$34.24 ,0.25,0.74%,4005427933,,2019,1591590,Consumer Services,Other Consumer Services
DAR,Darling Ingredients Inc. Common Stock,$70.21 ,1.14,1.65%,11378828262,United States,,1213345,Consumer Non-Durables,Packaged Foods
DARE,Dare Bioscience Inc. Common Stock,$2.30 ,-0.04,-1.71%,95671382,United States,2014,1298960,Health Care,Major Pharmaceuticals
DASH,DoorDash Inc. Class A Common Stock,$212.17 ,9.2,4.53%,67397184061,,2020,2660846,Miscellaneous,Business Services
DAUG,FT Cboe Vest U.S. Equity Deep Buffer ETF - August,$33.41 ,-0.005,-0.02%,,United States,2019,26552,,
DAVA,Endava plc American Depositary Shares (each representing one Class A Ordinary Share),$83.95 ,-1.95,-2.27%,4627101113,,2018,255329,Technology,EDP Services
DB,Deutsche Bank AG Common Stock,$11.35 ,0.46,4.22%,23431770037,Germany,,4333842,Finance,Major Banks
DBD,Diebold Nixdorf Incorporated Common Stock,$13.96 ,0.51,3.79%,1084390785,United States,,1617778,Miscellaneous,Office Equipment/Supplies/Services
DBDR,Roman DBDR Tech Acquisition Corp. Class A Common Stock,$10.34 ,0.05,0.49%,299291300,United States,2020,41092,Finance,Business Services
DBDRU,Roman DBDR Tech Acquisition Corp. Unit,$10.93 ,-0.01,-0.09%,0,United States,2020,1071,Finance,Business Services
DBDRW,Roman DBDR Tech Acquisition Corp. Warrant,$1.36 ,0.02,1.49%,0,United States,2020,139440,Finance,Business Services
DBI,Designer Brands Inc. Class A Common Stock,$12.64 ,0.44,3.61%,915045965,United States,,1601335,Consumer Services,Clothing/Shoe/Accessory Stores
DBL,DoubleLine Opportunistic Credit Fund Common Shares of Beneficial Interest,$19.63 ,-0.03,-0.15%,293603868,United States,2012,38433,,
DBOC,Innovator Double Stacker 9 Buffer ETF - October,$27.58 ,-0.0049,-0.02%,0,,2020,4249,,
DBTX,Decibel Therapeutics Inc. Common Stock,$18.10 ,0.07,0.39%,418554844,United States,2021,636812,Health Care,Major Pharmaceuticals
DBVT,DBV Technologies S.A. American Depositary Shares,$5.91 ,0.04,0.68%,647935581,France,2014,306600,Health Care,Biotechnology: Biological Products (No Diagnostic Substances)
DBX,Dropbox Inc. Class A Common Stock,$24.49 ,-0.02,-0.08%,10129486159,United States,2018,4433544,Technology,Computer Software: Prepackaged Software
DCBO,Docebo Inc. Common Shares,$54.47 ,-0.87,-1.57%,1780592598,Canada,,42478,Technology,Computer Software: Prepackaged Software
DCF,BNY Mellon Alcentra Global Credit Income 2024 Target Term Fund Inc. Common Stock,$8.98 ,-0.06,-0.66%,134368925,,2017,29024,,
DCI,Donaldson Company Inc. Common Stock,$61.02 ,-1.29,-2.07%,7703159857,United States,,400767,Capital Goods,Pollution Control Equipment
DCO,Ducommun Incorporated Common Stock,$56.06 ,0.45,0.81%,656719915,United States,,45512,Capital Goods,Military/Government/Technical
DCOM,Dime Community Bancshares Inc. Common Stock,$27.03 ,0.05,0.19%,893283710,United States,,154936,Finance,Savings Institutions
DCOMP,Dime Community Bancshares Inc. Fixed-Rate Non-Cumulative Perpetual Preferred Stock Series A,$25.16 ,-0.1899,-0.75%,0,United States,,39493,Finance,Savings Institutions
DCP,DCP Midstream  LP Common Units ,$22.17 ,1,4.72%,4619153376,United States,,1258768,Public Utilities,Natural Gas Distribution
DCP^B,DCP Midstream LP 7.875% Series B Fixed-to-Floating Rate Cumulative Redeemable Perpetual Preferred Units,$22.06 ,-0.11,-0.50%,,United States,,22946,,
DCP^C,DCP Midstream LP 7.95% Series C Fixed-to-Floating Rate Cumulative Redeemable Perpetual Preferred Units,$22.19 ,0.18,0.82%,,United States,,18786,,
DCPH,Deciphera Pharmaceuticals Inc. Common Stock,$47.79 ,-1.12,-2.29%,2753943816,United States,2017,555003,Health Care,Major Pharmaceuticals
DCRB,Decarbonization Plus Acquisition Corporation Class A Common Stock,$15.75 ,0.17,1.09%,444396125,United States,2020,1612063,Finance,Business Services
DCRBU,Decarbonization Plus Acquisition Corporation Unit,$17.76 ,0.18,1.02%,0,United States,2020,92652,Finance,Business Services
DCRBW,Decarbonization Plus Acquisition Corporation Warrant,$4.20 ,-0.19,-4.33%,0,United States,2020,211006,Finance,Business Services
DCRNU,Decarbonization Plus Acquisition Corporation II Unit,$11.35 ,0.18,1.61%,0,United States,2021,436037,Finance,Business Services
DCT,Duck Creek Technologies Inc. Common Stock,$58.30 ,0.26,0.45%,7638738378,United States,2020,645047,Technology,Computer Software: Prepackaged Software
DCTH,Delcath Systems Inc. Common Stock,$23.66 ,2,9.23%,137128273,United States,,97114,Health Care,Medical/Dental Instruments
DCUE,Dominion Energy Inc. 2019 Series A Corporate Units,$97.05 ,-0.61,-0.63%,0,United States,2019,21010,Public Utilities,Electric Utilities: Central
DD,DuPont de Nemours Inc. Common Stock,$70.99 ,-0.48,-0.67%,38081839537,,2017,6323150,Basic Industries,Major Chemicals
DDD,3D Systems Corporation Common Stock,$47.85 ,-0.03,-0.06%,5940191590,United States,,4373593,Technology,Computer Software: Prepackaged Software
DDEC,FT Cboe Vest U.S. Equity Deep Buffer ETF - December,$30.79 ,-0.02,-0.07%,,United States,2020,3419,,
DDF,Delaware Investments Dividend & Income Fund Inc. Common Stock,$9.68 ,-0.03,-0.31%,73676019,United States,1993,40158,,
DDMX,DD3 Acquisition Corp. II Class A Common Stock,$10.35 ,0,0.00%,74760120,Mexico,2021,23281,Finance,Business Services
DDMXU,DD3 Acquisition Corp. II Unit,$11.20 ,-0.2,-1.75%,0,Mexico,2020,5053,Finance,Business Services
DDMXW,DD3 Acquisition Corp. II Warrant,$2.08 ,0.035,1.72%,0,Mexico,2021,75870,Finance,Business Services
DDOG,Datadog Inc. Class A Common Stock,$107.56 ,-5.3,-4.70%,32755499458,United States,2019,4086593,Technology,Computer Software: Prepackaged Software
DDS,Dillard's Inc. Common Stock,$79.54 ,-1.17,-1.45%,1749712330,United States,,320163,Consumer Services,Department/Specialty Retail Stores
DDT,Dillard's Capital Trust I,$25.47 ,-0.0685,-0.27%,0,United States,,8800,Consumer Services,Department/Specialty Retail Stores
DE,Deere & Company Common Stock,$317.09 ,4.09,1.31%,99699863969,United States,,3098697,Capital Goods,Industrial Machinery/Components
DEA,Easterly Government Properties Inc. Common Stock,$22.08 ,-0.65,-2.86%,1793588539,United States,2015,573898,Consumer Services,Real Estate Investment Trusts
DECK,Deckers Outdoor Corporation Common Stock,$323.81 ,0.49,0.15%,9121701795,United States,1993,379716,Consumer Non-Durables,Shoe Manufacturing
DECZ,TrueShares Structured Outcome (December) ETF,$26.33 ,-0.0151,-0.06%,,United States,2020,26,,
DEFN,Emles Trust Emles Protective Allocation ETF,$24.49 ,-0.1819,-0.74%,,,2020,1506,,
DEH,D8 Holdings Corp. Class A Ordinary Shares,$10.45 ,-0.04,-0.38%,450656250,Hong Kong,2020,469226,Finance,Business Services
DEI,Douglas Emmett Inc. Common Stock,$29.33 ,-0.4,-1.35%,5143745406,United States,2006,1522672,Consumer Services,Real Estate Investment Trusts
DELL,Dell Technologies Inc. Class C Common Stock ,$79.44 ,-0.61,-0.76%,59564459788,,2018,3127682,Technology,Computer Manufacturing
DEN,Denbury Inc. Common Stock,$37.92 ,0.15,0.40%,1895999962,,2020,586881,Energy,Oil & Gas Production
DENN,Denny's Corporation Common Stock,$16.43 ,0,0.00%,1047710212,United States,,675468,Consumer Services,Restaurants
DEO,Diageo plc Common Stock,$169.51 ,2.43,1.45%,99151067983,United Kingdom,,402515,Consumer Non-Durables,Beverages (Production/Distribution)
DESP,Despegar.com Corp. Ordinary Shares,$12.82 ,0.69,5.69%,896707720,,2017,408658,Consumer Services,Transportation Services
DEX,Delaware Enhanced Global Dividend Common Shares of Beneficial Interest,$9.87 ,0.03,0.31%,117438185,United States,2007,39047,,
DFEB,FT Cboe Vest U.S. Equity Deep Buffer ETF - February,$32.69 ,-0.04,-0.12%,,United States,2020,31341,,
DFFN,Diffusion Pharmaceuticals Inc. Common Stock,$1.70 ,0.46,37.10%,108826250,United States,,107742392,Health Care,Major Pharmaceuticals
DFH,Dream Finders Homes Inc. Class A Common Stock,$24.90 ,-3.96,-13.72%,2303784902,United States,2021,561252,Capital Goods,Homebuilding
DFHT,Deerfield Healthcare Technology Acquisitions Corp. Class A Common Stock,$14.50 ,0.1,0.69%,260546875,United States,2020,24085,Health Care,Hospital/Nursing Management
DFHTU,Deerfield Healthcare Technology Acquisitions Corp. Unit,$14.54 ,0.18,1.25%,0,United States,2020,1969,Health Care,Hospital/Nursing Management
DFHTW,Deerfield Healthcare Technology Acquisitions Corp. Warrant,$3.50 ,0.15,4.48%,0,United States,2020,14312,Health Care,Hospital/Nursing Management
DFHY,TrimTabs Donoghue Forlines Tactical High Yield ETF,$25.37 ,-0.0302,-0.12%,,,2020,8228,,
DFIN,Donnelley Financial Solutions Inc. Common Stock ,$22.50 ,0.07,0.31%,750945825,,2016,204339,Consumer Services,Other Consumer Services
DFNS,LGL Systems Acquisition Corp. Common Stock,$10.72 ,-0.15,-1.38%,231150000,United States,2020,163232,Finance,Business Services
DFNV,TrimTabs Donoghue Forlines Risk Managed Innovation ETF,$28.22 ,-0.2056,-0.72%,,,2020,13480,,
DFP,Flaherty & Crumrine Dynamic Preferred and Income Fund Inc. Common Stock,$29.97 ,0.12,0.40%,574577617,,2013,65579,,
DFPH,DFP Healthcare Acquisitions Corp. Class A Common Stock,$10.96 ,0.21,1.95%,315100000,United States,2020,52541,Finance,Business Services
DFPHU,DFP Healthcare Acquisitions Corp. Unit,$11.50 ,0.22,1.95%,0,United States,2020,6016,Finance,Business Services
DFPHW,DFP Healthcare Acquisitions Corp. Warrant,$2.25 ,0.25,12.50%,0,United States,2020,4181,Finance,Business Services
DFS,Discover Financial Services Common Stock,$95.90 ,2.18,2.33%,29441300000,United States,,3049821,Finance,Finance: Consumer Services
DG,Dollar General Corporation Common Stock,$200.23 ,1.63,0.82%,49056530808,United States,2009,1681074,Consumer Services,Department/Specialty Retail Stores
DGICA,Donegal Group Inc. Class A Common Stock,$13.73 ,-0.13,-0.94%,408769079,United States,,90553,Finance,Property-Casualty Insurers
DGICB,Donegal Group Inc. Class B Common Stock,$12.10 ,-0.4,-3.20%,360240777,United States,1986,913,Finance,Property-Casualty Insurers
DGII,Digi International Inc. Common Stock,$23.99 ,-0.38,-1.56%,712726251,United States,1989,87264,Technology,Computer Communications Equipment
DGLY,Digital Ally Inc. Common Stock,$2.52 ,-0.05,-1.95%,101987401,United States,,6216127,Technology,Radio And Television Broadcasting And Communications Equipment
DGNR,Dragoneer Growth Opportunities Corp. Class A Ordinary Shares,$11.81 ,-0.26,-2.15%,1018612500,United States,2020,2251121,Finance,Business Services
DGNS,Dragoneer Growth Opportunities Corp. II Class A Ordinary Shares,$12.70 ,0.2,1.60%,401066000,United States,2020,140862,Finance,Business Services
DGX,Quest Diagnostics Incorporated Common Stock,$122.08 ,-3.94,-3.13%,16236640000,United States,,1580871,Health Care,Medical Specialities
DHC,Diversified Healthcare Trust Common Shares of Beneficial Interest,$4.46 ,-0.025,-0.56%,1061486069,United States,,1436677,Consumer Services,Real Estate Investment Trusts
DHCNI,Diversified Healthcare Trust 5.625% Senior Notes due 2042,$22.82 ,-0.28,-1.21%,0,United States,,26826,Consumer Services,Real Estate Investment Trusts
DHCNL,Diversified Healthcare Trust 6.25% Senior Notes Due 2046,$23.42 ,-0.46,-1.93%,0,United States,,21771,Consumer Services,Real Estate Investment Trusts
DHF,BNY Mellon High Yield Strategies Fund Common Stock,$3.04 ,0,0.00%,221031372,United States,1998,2295204,,
DHHCU,DiamondHead Holdings Corp. Unit,$10.90 ,0.1,0.93%,0,United States,2021,472608,Finance,Business Services
DHI,D.R. Horton Inc. Common Stock,$78.96 ,-3.22,-3.92%,28717887180,United States,,3706850,Capital Goods,Homebuilding
DHIL,Diamond Hill Investment Group Inc. Class A Common Stock,$142.35 ,-1.7,-1.18%,450290915,United States,,10486,Finance,Investment Managers
DHR,Danaher Corporation Common Stock,$242.27 ,-3.63,-1.48%,1.72254E+11,United States,,1637199,Capital Goods,Industrial Machinery/Components
DHR^A,Danaher Corporation 4.75% Mandatory Convertible Preferred Stock Series A,"$1,650.87 ",-20.37,-1.22%,,United States,,1414,,
DHR^B,Danaher Corporation 5.00% Mandatory Convertible Preferred Stock Series B,"$1,390.34 ",-11.51,-0.82%,,United States,,1188,,
DHT,DHT Holdings Inc.,$6.23 ,0.28,4.71%,1064073583,Jersey,2005,6996041,Transportation,Marine Transportation
DHX,DHI Group Inc. Common Stock,$2.94 ,-0.07,-2.33%,153586073,United States,2007,198485,Miscellaneous,Business Services
DHY,Credit Suisse High Yield Bond Fund Common Stock,$2.34 ,-0.04,-1.68%,242207321,United States,1998,2745387,,
DIAX,Nuveen Dow 30SM Dynamic Overwrite Fund Common Shares of Beneficial Interest,$15.16 ,0.05,0.33%,551322401,,2014,135927,,
DIN,Dine Brands Global Inc. Common Stock,$74.62 ,1.1,1.50%,1225167050,United States,,311334,Consumer Services,Restaurants
DIOD,Diodes Incorporated Common Stock,$81.78 ,-0.36,-0.44%,4255991734,United States,,187970,Technology,Semiconductors
DIS,Walt Disney Company (The) Common Stock,$186.35 ,-1.32,-0.70%,3.38274E+11,United States,,11616584,Consumer Services,Services-Misc. Amusement & Recreation
DISCA,Discovery Inc. Series A Common Stock,$47.35 ,-0.45,-0.94%,23256062447,United States,,6878166,Consumer Services,Television Services
DISCB,Discovery Inc. Series B Common Stock,$50.00 ,1.9,3.95%,24557616100,United States,,794,Consumer Services,Television Services
DISCK,Discovery Inc. Series C Common Stock,$40.50 ,-0.25,-0.61%,19891669041,United States,,3145510,Consumer Services,Television Services
DISH,DISH Network Corporation Class A Common Stock,$32.26 ,0.895,2.85%,16966403103,United States,1995,2891219,Consumer Services,Television Services
DIT,AMCON Distributing Company Common Stock,$108.18 ,1.18,1.10%,59647098,United States,,258,Consumer Non-Durables,Food Distributors
DJAN,FT Cboe Vest U.S. Equity Deep Buffer ETF - January,$30.46 ,0.0202,0.07%,,United States,2021,27617,,
DJCO,Daily Journal Corp. (S.C.) Common Stock,$328.00 ,-1.06,-0.32%,452884688,United States,,4135,Consumer Services,Newspapers/Magazines
DJUL,FT Cboe Vest U.S. Equity Deep Buffer ETF - July,$31.95 ,0.0107,0.03%,,United States,2020,157,,
DJUN,FT Cboe Vest U.S. Equity Deep Buffer ETF - June,$32.69 ,0.0097,0.03%,,United States,2020,3975,,
DK,Delek US Holdings Inc. Common Stock,$23.28 ,0.85,3.79%,1716335646,United States,2017,1139333,Energy,Integrated oil Companies
DKL,Delek Logistics Partners L.P. Common Units representing Limited Partner Interests,$40.70 ,0,0.00%,1767732827,United States,2012,48093,Energy,Natural Gas Distribution
DKNG,DraftKings Inc. Class A Common Stock,$60.50 ,-0.57,-0.93%,23698686473,United States,2019,6171496,Consumer Services,Services-Misc. Amusement & Recreation
DKS,Dick's Sporting Goods Inc Common Stock,$73.98 ,-1,-1.33%,6628509977,United States,2002,1517813,Consumer Services,Other Specialty Stores
DL,China Distance Education Holdings Limited American Depositary Shares,$9.65 ,0,0.00%,326460542,China,,95064,Consumer Services,Other Consumer Services
DLA,Delta Apparel Inc. Common Stock,$27.60 ,-0.02,-0.07%,192500616,United States,,80128,Consumer Non-Durables,Apparel
DLB,Dolby Laboratories Common Stock,$94.85 ,0.41,0.43%,9637989541,United States,2005,450552,Miscellaneous,Multi-Sector Companies
DLCAU,Deep Lake Capital Acquisition Corp. Unit,$10.80 ,0.03,0.28%,0,United States,2021,20783,Finance,Business Services
DLHC,DLH Holdings Corp.,$10.88 ,-0.37,-3.29%,136477697,United States,,21935,Technology,Professional Services
DLNG,Dynagas LNG Partners LP Common Units,$3.18 ,0.2027,6.81%,113248004,Greece,,279108,Consumer Services,Marine Transportation
DLNG^A,Dynagas LNG Partners LP 9.00% Series A Cumulative Redeemable Preferred Units,$24.60 ,-0.05,-0.20%,,Greece,,9023,,
DLNG^B,Dynagas LNG Partners LP 8.75% Series B Fixed to Floating Rate Cumulative Redeemable Perpetual Preferred Units liquidation preference $25.00 per Uni,$21.00 ,-0.25,-1.18%,,Greece,,17843,,
DLPN,Dolphin Entertainment Inc. Common Stock,$4.82 ,-0.38,-7.31%,31620848,United States,,693968,Consumer Services,Other Consumer Services
DLR,Digital Realty Trust Inc. Common Stock,$137.20 ,-2.86,-2.04%,38455750407,United States,2004,2529620,Consumer Services,Real Estate Investment Trusts
DLR^C,Digital Realty Trust Inc. 6.625% Series C Cumulative Redeemable Perpetual Preferred Stock,$25.62 ,0.03,0.12%,,United States,,18299,,
DLR^J,Digital Realty Trust Inc. 5.250% Series J Cumulative Redeemable Preferred Stock,$25.88 ,-0.21,-0.81%,,United States,,10531,,
DLR^K,Digital Realty Trust Inc. 5.850% Series K Cumulative Redeemable Preferred Stock par value $0.01 per share,$27.06 ,-0.1999,-0.73%,,United States,,20096,,
DLR^L,Digital Realty Trust Inc. 5.200% Series L Cumulative Redeemable Preferred Stock,$26.52 ,-0.27,-1.01%,,United States,,21311,,
DLTH,Duluth Holdings Inc. Class B Common Stock,$14.07 ,0.16,1.15%,461892718,United States,2015,145429,Consumer Services,Clothing/Shoe/Accessory Stores
DLTR,Dollar Tree Inc. Common Stock,$107.65 ,-0.725,-0.67%,25318435163,United States,1995,1462211,Consumer Services,Department/Specialty Retail Stores
DLX,Deluxe Corporation Common Stock,$38.92 ,1.08,2.85%,1630514013,United States,,294887,Consumer Durables,Publishing
DLY,DoubleLine Yield Opportunities Fund Common Shares of Beneficial Interest,$19.56 ,0.005,0.03%,0,,2020,383227,,
