Symbol,Name,Last Sale,Net Change,% Change,Market Cap,Country,IPO Year,Volume,Sector,Industry
PSA^F,Public Storage Depositary Shares Each Representing 1/1000 of a 5.15% Cumulative Preferred Share of Beneficial Interest Series F par value $0.01 per share,$25.83 ,-0.165,-0.64%,,United States,,25068,Consumer Services,Real Estate Investment Trusts
PSA^G,Public Storage Depositary Shares Each Representing 1/1000 of a 5.05% Cumulative Preferred Share of Beneficial Interest Series G,$26.11 ,-0.41,-1.55%,,United States,,15601,,
PSA^H,Public Storage Depositary Shares Each Representing 1/1000 of a  5.60% Cumulative Preferred  Share of Beneficial Interest Series H,$27.30 ,-0.2913,-1.06%,,United States,,18385,,
PSA^I,Public Storage Depositary Shares Each Representing 1/1000 of a 4.875% Cumulative Preferred Share of Beneficial Interest Series I par value $0.01 per share,$26.44 ,-0.41,-1.53%,,United States,,57311,,
PSA^J,Public Storage Depositary Shares Each Representing 1/1000 of a 4.700% Cumulative Preferred Share of Beneficial Interest Series J par value $0.01 per share,$25.75 ,-0.54,-2.05%,,United States,,19249,,
PSA^K,Public Storage Depositary Shares Each Representing 1/1000 of a 4.75% Cumulative Preferred Share of Beneficial Interest Series K,$26.56 ,-0.4135,-1.53%,,United States,,26094,Consumer Services,Real Estate Investment Trusts
PSA^L,Public Storage Depositary Shares Each Representing 1/1000 of a 4.625% Cumulative Preferred Share of Beneficial Interest Series L par value $0.01 per share,$25.49 ,-0.73,-2.78%,,United States,,261306,Consumer Services,Real Estate Investment Trusts
PSA^M,Public Storage Depositary Shares Each Representing 1/1000 of a 4.125% Cumulative Preferred Share of Beneficial Interest Series M,$25.62 ,-0.45,-1.73%,,United States,,24744,,
PSA^N,Public Storage Depositary Shares Each Representing 1/1000 of a 3.875% Cumulative Preferred Share of Beneficial Interest Series N,$24.77 ,-0.39,-1.55%,,United States,,71082,,
PSA^O,Public Storage Depositary Shares Each Representing 1/1000 of a 3.900% Cumulative Preferred Share of Beneficial Interest Series O,$25.44 ,-0.38,-1.47%,,United States,,48944,,
PSAC,Property Solutions Acquisition Corp. Common Stock,$16.92 ,1.34,8.60%,499419366,United States,2020,2369664,Capital Goods,Auto Manufacturing
PSACU,Property Solutions Acquisition Corp. Unit,$20.72 ,1.46,7.58%,0,United States,2020,18786,Capital Goods,Auto Manufacturing
PSACW,Property Solutions Acquisition Corp. Warrant,$3.87 ,0.13,3.48%,0,United States,2020,975485,Capital Goods,Auto Manufacturing
PSB,PS Business Parks Inc. Common Stock,$144.92 ,-0.16,-0.11%,3983640231,United States,,79418,Consumer Services,Real Estate Investment Trusts
PSB^W,PS Business Parks Inc. Depositary Shares Each Representing 1/1000 of a Share of 5.20% Cumulative Preferred Stock Series W,$25.48 ,-0.02,-0.08%,,United States,,15982,,
PSB^X,PS Business Parks Inc. Depositary Shares Each Representing 1/1000 of a Share of 5.25% Cumulative Preferred Stock Series X,$25.96 ,-0.3,-1.14%,,United States,,14503,,
PSB^Y,PS Business Parks Inc. 5.20% Cumulative Preferred Stock Series Y,$25.65 ,-0.25,-0.97%,,United States,,22549,,
PSB^Z,PS Business Parks Inc. Depositary Shares Each Representing 1/1000 of a Share of 4.875% Cumulative Preferred Stock Series Z  par value $0.01 per share,$25.88 ,-0.46,-1.75%,,United States,,39859,,
PSCX,Pacer Swan SOS Conservative (December) ETF,$21.05 ,-0.0203,-0.10%,,United States,2020,87,,
PSEC,Prospect Capital Corporation Common Stock,$7.28 ,0.02,0.28%,2807611461,United States,2004,2842670,,
PSF,Cohen & Steers Select Preferred and Income Fund Inc. Common Stock,$27.34 ,-0.25,-0.91%,328422762,,2010,16786,,
PSFD,Pacer Funds ETF,$21.44 ,-0.0344,-0.16%,,United States,2020,10,,
PSFF,Pacer Swan SOS Fund of Funds ETF,$20.84 ,-0.0025,-0.01%,,United States,2020,3098,,
PSHG,Performance Shipping Inc. Common Shares,$7.10 ,-0.04,-0.56%,36087355,Greece,,309782,Transportation,Marine Transportation
PSMD,Pacer Swan SOS Moderate (December) ETF,$21.17 ,-0.0215,-0.10%,,United States,2020,5,,
PSMT,PriceSmart Inc. Common Stock,$99.95 ,-1.53,-1.51%,3072296483,United States,,133105,Consumer Services,Department/Specialty Retail Stores
PSN,Parsons Corporation Common Stock,$39.39 ,-0.07,-0.18%,3967641217,,2019,724850,Technology,EDP Services
PSNL,Personalis Inc. Common Stock,$40.27 ,-0.15,-0.37%,1567824057,United States,2019,773948,Health Care,Medical Specialities
PSO,Pearson Plc Common Stock,$10.77 ,0.19,1.80%,8117224273,United Kingdom,,223924,Consumer Services,Books
PSTG,Pure Storage Inc. Class A Common Stock,$28.10 ,-0.8,-2.77%,7665988791,,2015,4082809,Technology,Electronic Components
PSTH,Pershing Square Tontine Holdings Ltd. Class A Common Stock,$32.95 ,2.74,9.07%,6590003295,,2020,9432775,Finance,Business Services
PSTI,Pluristem Therapeutics Inc. Common Stock,$7.85 ,-0.01,-0.13%,247504746,Israel,,659119,Health Care,Biotechnology: Biological Products (No Diagnostic Substances)
PSTL,Postal Realty Trust Inc. Class A Common Stock,$16.25 ,0,0.00%,214728443,,2019,76479,Consumer Services,Real Estate Investment Trusts
PSTV,PLUS THERAPEUTICS Inc. Common Stock ,$3.50 ,-0.14,-3.85%,16728544,United States,,923122,Health Care,Medical/Dental Instruments
PSTX,Poseida Therapeutics Inc. Common Stock,$10.05 ,0.46,4.80%,621291101,United States,2020,707756,Health Care,Biotechnology: Biological Products (No Diagnostic Substances)
PSX,Phillips 66 Common Stock,$79.39 ,2.16,2.80%,34677566687,United States,,2761765,Energy,Integrated oil Companies
PSXP,Phillips 66 Partners LP Common Units representing limited partner interest in the Partnership,$26.61 ,0.89,3.46%,6076131285,United States,2013,1267820,Energy,Natural Gas Distribution
PT,Pintec Technology Holdings Limited American Depositary Shares,$2.23 ,0.25,12.63%,96198311,China,2018,3167443,Technology,Computer Software: Programming Data Processing
PTA,Cohen & Steers Tax-Advantaged Preferred Securities and Income Fund Common Shares of Beneficial Interest,$25.25 ,0.13,0.52%,0,,2020,107373,,
PTC,PTC Inc. Common Stock,$146.13 ,3.41,2.39%,17069506382,United States,,701146,Technology,Computer Software: Prepackaged Software
PTCT,PTC Therapeutics Inc. Common Stock,$60.41 ,-1.02,-1.66%,4122120993,United States,2013,500471,Health Care,Major Pharmaceuticals
PTE,PolarityTE Inc. Common Stock,$1.60 ,-0.09,-5.33%,106884515,United States,,9030829,Health Care,Biotechnology: Biological Products (No Diagnostic Substances)
PTEN,Patterson-UTI Energy Inc. Common Stock,$6.35 ,0.1,1.60%,1192126273,United States,1993,1844283,Energy,Oil & Gas Production
PTGX,Protagonist Therapeutics Inc. Common Stock,$27.02 ,0.88,3.37%,1162365166,United States,2016,392587,Health Care,Major Pharmaceuticals
PTIC,PropTech Investment Corporation II Class A Common Stock,$10.45 ,-0.05,-0.48%,0,United States,2021,12627,Finance,Business Services
PTICU,PropTech Investment Corporation II Unit,$10.92 ,-0.13,-1.18%,0,United States,2020,23318,Finance,Business Services
PTICW,PropTech Investment Corporation II Warrant,$1.83 ,-0.0548,-2.92%,0,United States,2021,29461,Finance,Business Services
PTK,PTK Acquisition Corp. Common Stock,$10.25 ,0,0.00%,147343750,United States,2020,9165,Finance,Business Services
PTMN,Portman Ridge Finance Corporation Common Stock,$2.09 ,0.06,2.96%,146643241,United States,,536225,,
PTN,Palatin Technologies Inc. Common Stock,$1.13 ,-0.02,-1.74%,259788477,United States,,6400274,Health Care,Major Pharmaceuticals
PTNR,Partner Communications Company Ltd. American Depositary Shares,$4.75 ,0.125,2.71%,871757877,Israel,,5905,Public Utilities,Telecommunications Equipment
PTON,Peloton Interactive Inc. Class A Common Stock,$145.88 ,-8.79,-5.68%,42961902890,United States,2019,6737768,Energy,Consumer Electronics/Appliances
PTPI,Petros Pharmaceuticals Inc. Common Stock,$4.34 ,-0.06,-1.36%,42394522,United States,,14011,Health Care,Major Pharmaceuticals
PTR,PetroChina Company Limited Common Stock,$35.10 ,3.03,9.45%,64240363208,China,,369372,Energy,Oil & Gas Production
PTRS,Partners Bancorp Common Stock,$6.90 ,0.06,0.88%,122890470,United States,,19646,Finance,Major Banks
PTSI,P.A.M. Transportation Services Inc. Common Stock,$59.20 ,-1,-1.66%,339483110,United States,1986,8812,Transportation,Trucking Freight/Courier Services
PTVCA,Protective Insurance Corporation Class A Common Stock,$22.90 ,6.65,40.92%,326688354,United States,,192768,Finance,Property-Casualty Insurers
PTVCB,Protective Insurance Corporation Class B Common Stock,$22.90 ,7.89,52.57%,326688354,United States,,1469391,Finance,Property-Casualty Insurers
PTVE,Pactiv Evergreen Inc. Common stock,$16.34 ,0.28,1.74%,2894756981,United States,2020,162229,Consumer Durables,Containers/Packaging
PTY,Pimco Corporate & Income Opportunity Fund,$17.98 ,0.01,0.06%,1909497846,United States,2002,383505,,
PUBM,PubMatic Inc. Class A Common Stock,$50.01 ,0.22,0.44%,2391803465,United States,2020,534200,Technology,Computer Software: Programming Data Processing
PUCKU,Goal Acquisitions Corp. Unit,$10.60 ,-0.05,-0.47%,0,United States,2021,272267,Finance,Business Services
PUK,Prudential Public Limited Company Common Stock,$38.73 ,1.88,5.10%,50533312739,United Kingdom,,307161,Finance,Life Insurance
PUK^,Prudential Public Limited Company 6.75% Perpetual Subordinated Captial Security,$26.40 ,-0.32,-1.20%,,United Kingdom,,23434,,
PUK^A,Prudential Public Limited Company 6.50% Perpetual Subordinated Capital Securities Exchangeable at the Issuer's Option Into Non-Cumulative Dollar Denominated Preference Shares,$26.35 ,-0.48,-1.79%,,United Kingdom,,15980,,
PULM,Pulmatrix Inc. Common Stock,$2.11 ,0.09,4.46%,72599789,United States,2014,11546658,Health Care,Major Pharmaceuticals
PUMP,ProPetro Holding Corp. Common Stock,$9.90 ,0.48,5.10%,999036492,United States,2017,820458,Energy,Oilfield Services/Equipment
PUYI,Puyi Inc. American Depository Shares,$6.42 ,0.3197,5.24%,387503699,China,2019,19363,Finance,Investment Managers
PVAC,Penn Virginia Corporation Common Stock,$13.80 ,1.03,8.07%,521871771,United States,,759638,Energy,Oil & Gas Production
PVBC,Provident Bancorp Inc. (MD) Common Stock,$12.35 ,-0.07,-0.56%,235237168,United States,2015,44793,Finance,Savings Institutions
PVG,Pretium Resources Inc. Ordinary Shares (Canada),$10.74 ,-0.13,-1.20%,2011105200,Canada,,1131006,Basic Industries,Precious Metals
PVH,PVH Corp. Common Stock,$97.58 ,1.43,1.49%,6937962395,United States,,839604,Consumer Non-Durables,Apparel
PVL,Permianville Royalty Trust Trust Units ,$1.57 ,0.15,10.56%,51810000,United States,2011,2123434,Energy,Oil & Gas Production
PW,Power REIT (MD) Common Stock,$48.57 ,4.79,10.94%,93066871,United States,,117495,Consumer Services,Real Estate Investment Trusts
PW^A,Power REIT 7.75% Series A Cumulative Perpetual Preferred Stock,$26.08 ,0.18,0.70%,,United States,,1657,,
PWFL,PowerFleet Inc. Common Stock,$8.07 ,0.11,1.38%,282054118,United States,,234803,Capital Goods,Telecommunications Equipment
PWOD,Penns Woods Bancorp Inc. Common Stock,$22.80 ,-0.285,-1.24%,160793603,United States,,19970,Finance,Major Banks
PWR,Quanta Services Inc. Common Stock,$77.61 ,-0.26,-0.33%,10776994449,United States,,629268,Capital Goods,Engineering & Construction
PXD,Pioneer Natural Resources Company Common Stock,$136.16 ,3.87,2.93%,29438756830,United States,,3939998,Energy,Oil & Gas Production
PXLW,Pixelworks Inc.  Common Stock,$4.42 ,0.01,0.23%,224850717,United States,2000,1011296,Technology,Semiconductors
PXS,Pyxis Tankers Inc. Common Stock,$2.96 ,1.43,93.46%,63817260,Greece,,45271765,Transportation,Marine Transportation
PXSAP,Pyxis Tankers Inc. 7.75% Series A Cumulative Convertible Preferred Shares,$21.08 ,1.4147,7.19%,0,Greece,,4388,Transportation,Marine Transportation
PXSAW,Pyxis Tankers Inc. Warrant,$0.81 ,0.3451,74.23%,0,Greece,,150591,Transportation,Marine Transportation
PYN,PIMCO New York Municipal Income Fund III Common Shares of Beneficial Interest,$9.21 ,-0.08,-0.86%,52755718,United States,2002,8144,,
PYPD,PolyPid Ltd. Ordinary Shares,$14.86 ,-0.29,-1.91%,274831822,Israel,2020,281730,Health Care,Medical/Dental Instruments
PYPL,PayPal Holdings Inc. Common Stock,$304.79 ,6.42,2.15%,3.56963E+11,United States,,13584225,Miscellaneous,Business Services
PYS,Merrill Lynch Depositor Inc PPlus Tr Ser RRD-1 Tr Ctf Cl A,$21.30 ,-0.13,-0.61%,0,United States,,6369,Finance,Finance: Consumer Services
PYT,PPlus Tr GSC-2 Tr Ctf Fltg Rate,$24.50 ,-0.11,-0.45%,0,United States,,14767,Finance,Finance: Consumer Services
PZC,PIMCO California Municipal Income Fund III Common Shares of Beneficial Interest,$10.77 ,0.08,0.75%,240965137,United States,2002,51944,,
PZG,Paramount Gold Nevada Corp. Common Stock,$1.21 ,0.01,0.83%,43834121,United States,2015,416906,Basic Industries,Precious Metals
PZN,Pzena Investment Management Inc Class A Common Stock,$9.15 ,0.06,0.66%,651205198,United States,2007,75290,Finance,Investment Managers
PZZA,Papa John's International Inc. Common Stock,$102.54 ,-6.6,-6.05%,3378916947,United States,1993,521992,Consumer Services,Restaurants
QADA,QAD Inc. Class A Common Stock,$68.40 ,-2.71,-3.81%,1415816867,United States,,26274,Technology,Computer Software: Prepackaged Software
QADB,QAD Inc. Class B Common Stock,$51.30 ,-0.89,-1.71%,1061862650,United States,,594,Technology,Computer Software: Prepackaged Software
QCOM,QUALCOMM Incorporated Common Stock,$147.16 ,-0.82,-0.55%,1.67174E+11,United States,1991,10205347,Technology,Radio And Television Broadcasting And Communications Equipment
QCRH,QCR Holdings Inc. Common Stock,$41.29 ,0.37,0.90%,652107711,United States,,42010,Finance,Major Banks
QD,Qudian Inc. American Depositary Shares each representing one Class A Ordinary Share,$3.66 ,0.02,0.55%,928649417,China,2017,11595916,Finance,Finance: Consumer Services
QDEC,FT Cboe Vest Growth-100 Buffer ETF - December,$20.59 ,-0.1347,-0.65%,,United States,2020,30910,,
QDEL,Quidel Corporation Common Stock,$221.94 ,-6.03,-2.65%,9336493353,United States,,618640,Health Care,Biotechnology: In Vitro & In Vivo Diagnostic Substances
QELL,Qell Acquisition Corp. Class A Ordinary Shares,$13.20 ,-0.21,-1.57%,626175000,United States,2020,972797,Finance,Business Services
QELLU,Qell Acquisition Corp. Unit,$14.26 ,-0.27,-1.86%,0,United States,2020,24339,Finance,Business Services
QELLW,Qell Acquisition Corp. Warrant,$3.61 ,-0.0296,-0.81%,0,United States,2020,163952,Finance,Business Services
QEP,QEP Resources Inc. Common Stock,$3.45 ,-0.01,-0.29%,836852082,United States,,3295023,Energy,Oil & Gas Production
QFIN,360 DigiTech Inc. American Depositary Shares,$30.98 ,3.42,12.41%,4712415757,China,2018,6478103,Finance,Finance: Consumer Services
QGEN,Qiagen N.V. Common Shares ,$55.21 ,-0.81,-1.45%,12587051850,Netherlands,,1034791,Health Care,Biotechnology: Biological Products (No Diagnostic Substances)
QH,Quhuo Limited American Depository Shares,$9.44 ,1.31,16.11%,489996510,China,2020,470374,Miscellaneous,Business Services
QIWI,QIWI plc American Depositary Shares,$11.85 ,0.01,0.08%,743148754,Cyprus,2013,611049,Miscellaneous,Business Services
QK,Q&K International Group Limited American Depositary Shares,$3.62 ,-0.11,-2.95%,196245018,China,2019,158212,Finance,Real Estate
QLGN,Qualigen Therapeutics Inc. Common Stock,$4.19 ,0.24,6.08%,111902535,United States,2015,2778084,Health Care,Major Pharmaceuticals
QLI,Qilian International Holding Group Ltd. Ordinary Shares,$7.42 ,0.09,1.23%,259700000,China,2021,354804,Health Care,Major Pharmaceuticals
QLYS,Qualys Inc. Common Stock,$103.75 ,0.21,0.20%,4047971316,United States,2012,631776,Technology,Computer Software: Prepackaged Software
QMCO,Quantum Corporation Common Stock,$8.64 ,0.28,3.35%,489570108,United States,,736270,Technology,Electronic Components
QNST,QuinStreet Inc. Common Stock,$24.40 ,-0.36,-1.45%,1300434624,United States,2010,382650,Miscellaneous,Business Services
QQQX,Nuveen NASDAQ 100 Dynamic Overwrite Fund Shares of Beneficial Interest,$27.07 ,0.1,0.37%,1108697192,United States,,112347,,
QRHC,Quest Resource Holding Corporation Common Stock,$3.26 ,0.06,1.88%,59922800,United States,,141906,Technology,Diversified Commercial Services
QRTEA,Qurate Retail Inc. Series A Common Stock ,$13.48 ,0.35,2.67%,5624145672,United States,,6443332,Consumer Services,Catalog/Specialty Distribution
QRTEB,Qurate Retail Inc. Series B Common Stock ,$13.55 ,0.32,2.42%,5653351176,United States,,5729,Consumer Services,Catalog/Specialty Distribution
QRTEP,Qurate Retail Inc. 8.0% Fixed Rate Cumulative Redeemable Preferred Stock,$100.08 ,-0.77,-0.76%,0,United States,,155152,Consumer Services,Catalog/Specialty Distribution
QRVO,Qorvo Inc. Common Stock,$177.03 ,1.03,0.59%,20050897020,United States,,1402482,Technology,Semiconductors
QS,QuantumScape Corporation Class A Common Stock,$50.64 ,-4,-7.32%,18430949795,United States,2020,22514216,Miscellaneous,Industrial Machinery/Components
QSR,Restaurant Brands International Inc. Common Shares,$59.30 ,0.25,0.42%,17974616259,Canada,2014,1646921,Consumer Services,Restaurants
QTNT,Quotient Limited Ordinary Shares,$5.38 ,0.09,1.70%,544096901,Switzerland,2014,850786,Health Care,Biotechnology: In Vitro & In Vivo Diagnostic Substances
QTRX,Quanterix Corporation Common Stock,$87.26 ,0.74,0.86%,2778038941,United States,2017,366187,Capital Goods,Biotechnology: Laboratory Analytical Instruments
QTS,QTS Realty Trust Inc. Class A Common Stock,$61.72 ,-1.97,-3.09%,3976959307,United States,2013,557723,Consumer Services,Real Estate Investment Trusts
QTS^A,QTS Realty Trust Inc. 7.125% Series A Cumulative Redeemable Perpetual Preferred Stock,$26.75 ,-0.68,-2.48%,,United States,,18787,,
QTS^B,QTS Realty Trust Inc. 6.50% Series B Cumulative Convertible Perpetual Preferred Stock,$139.58 ,-3.52,-2.46%,,United States,,2942,,
QTT,Qutoutiao Inc. American Depositary Shares,$5.33 ,0.49,10.12%,1422182857,China,2018,12964970,Technology,Computer Software: Programming Data Processing
QTWO,Q2 Holdings Inc. Common Stock,$146.70 ,0.96,0.66%,7904660892,,2014,328249,Technology,Computer Software: Prepackaged Software
QUAD,Quad Graphics Inc Class A Common Stock,$5.35 ,-0.36,-6.31%,287062329,United States,,205627,Miscellaneous,Publishing
QUIK,QuickLogic Corporation Common Stock,$7.06 ,0.02,0.28%,78143462,United States,1999,874414,Technology,Semiconductors
QUMU,Qumu Corporation Common Stock,$9.68 ,-0.4,-3.97%,169787965,United States,,172458,Technology,Computer Software: Prepackaged Software
QUOT,Quotient Technology Inc. Common Stock,$12.60 ,-0.11,-0.87%,1146670031,,2014,1308346,Consumer Services,Advertising
QURE,uniQure N.V. Ordinary Shares,$36.61 ,-0.71,-1.90%,1629003722,Netherlands,2014,410652,Health Care,Major Pharmaceuticals
QVCC,QVC Inc. 6.250% Senior Secured Notes due 2068,$25.13 ,0.02,0.08%,0,United States,2019,59477,Consumer Services,Catalog/Specialty Distribution
QVCD,QVC Inc. 6.375% Senior Secured Notes due 2067,$25.28 ,-0.15,-0.59%,0,United States,2018,7062,Consumer Services,Catalog/Specialty Distribution
R,Ryder System Inc. Common Stock,$63.94 ,-0.9,-1.39%,3445670525,United States,,488685,Consumer Services,Rental/Leasing Companies
RA,Brookfield Real Assets Income Fund Inc. Common Stock,$19.20 ,0.02,0.10%,842694010,,2016,314060,,
RAAC,Revolution Acceleration Acquisition Corp Class A Common Stock,$10.51 ,-0.3,-2.78%,402883330,United States,2021,41114,Finance,Business Services
RAACU,Revolution Acceleration Acquisition Corp Unit,$11.30 ,0.12,1.07%,0,United States,2020,52116,Finance,Business Services
RAACW,Revolution Acceleration Acquisition Corp Warrant,$2.50 ,-0.3135,-11.14%,0,United States,2021,21149,Finance,Business Services
RAAS,Cloopen Group Holding Limited American Depositary Shares each representing two Class A Ordinary Shares,$29.65 ,-1.64,-5.24%,4739413175,,2021,2115010,Technology,Computer Software: Prepackaged Software
RACA,Therapeutics Acquisition Corp. Class A Common Stock,$16.05 ,-0.1664,-1.03%,279876857,United States,2020,4275,Finance,Business Services
RACE,Ferrari N.V. Common Shares,$201.97 ,-3.38,-1.65%,50107709180,,2015,230089,Capital Goods,Auto Manufacturing
RAD,Rite Aid Corporation Common Stock,$22.46 ,-2.51,-10.05%,1240339193,United States,,3207045,Health Care,Medical/Nursing Services
RADA,RADA Electronic Industries Ltd. Ordinary Shares,$14.25 ,1.31,10.12%,619662176,Israel,,1689567,Technology,Electronic Components
RADI,Radius Global Infrastructure Inc. Class A Common Stock,$13.57 ,-0.03,-0.22%,826405143,United States,,390173,Consumer Services,Real Estate
RAIL,FreightCar America Inc. Common Stock,$3.79 ,-0.16,-4.05%,58877002,United States,2005,302762,Capital Goods,Railroads
RAMP,LiveRamp Holdings Inc. Common Stock,$70.89 ,-0.04,-0.06%,4743917046,United States,2018,732629,Technology,EDP Services
RAND,Rand Capital Corporation Common Stock,$15.80 ,0.28,1.80%,40823598,United States,,8770,Finance,Finance: Consumer Services
RAPT,RAPT Therapeutics Inc. Common Stock,$21.10 ,-0.85,-3.87%,518115965,United States,2019,119406,Health Care,Major Pharmaceuticals
RARE,Ultragenyx Pharmaceutical Inc. Common Stock,$144.34 ,-5.92,-3.94%,9663453879,United States,2014,480627,Health Care,Major Pharmaceuticals
RAVE,Rave Restaurant Group Inc. Common Stock,$1.55 ,-0.15,-8.82%,27907601,United States,,1306875,Consumer Non-Durables,Food Distributors
RAVN,Raven Industries Inc. Common Stock,$37.86 ,0.51,1.37%,1357424300,United States,,209329,Capital Goods,Specialty Chemicals
RBA,Ritchie Bros. Auctioneers Incorporated Common Stock,$57.43 ,-0.57,-0.98%,6300778652,Canada,,675939,Miscellaneous,Business Services
RBAC,RedBall Acquisition Corp. Class A Ordinary Shares,$10.92 ,0.17,1.58%,784875000,United States,2020,1741772,Finance,Business Services
RBB,RBB Bancorp Common Stock,$18.70 ,0.45,2.47%,365882723,United States,2017,58531,Finance,Major Banks
RBBN,Ribbon Communications Inc. Common Stock,$11.14 ,0.6,5.69%,1619718469,United States,,776597,Technology,EDP Services
RBC,Regal Beloit Corporation Common Stock,$132.95 ,4,3.10%,5397142742,United States,,572685,Consumer Durables,Metal Fabrications
RBCAA,Republic Bancorp Inc. Class A Common Stock,$40.81 ,-0.4,-0.97%,853380930,United States,1998,28708,Finance,Major Banks
RBCN,Rubicon Technology Inc. Common Stock,$11.45 ,0.19,1.69%,27729862,United States,2007,14517,Technology,Semiconductors
RBKB,Rhinebeck Bancorp Inc. Common Stock,$9.65 ,0.1823,1.93%,107445155,United States,2019,4790,Finance,Banks
RBNC,Reliant Bancorp Inc. Common Stock,$21.18 ,0.51,2.47%,352740383,United States,,37987,Finance,Major Banks
RC,Ready Capital Corproation Common Stock,$13.19 ,0.37,2.89%,728629819,United States,2013,403488,Consumer Services,Real Estate Investment Trusts
RCA,Ready Capital Corporation 7.00% Convertible Senior Notes due 2023,$25.37 ,-0.08,-0.31%,0,United States,2017,29778,Consumer Services,Real Estate Investment Trusts
RCB,Ready Capital Corporation 6.20% Senior Notes due 2026,$25.45 ,0.07,0.28%,0,United States,2019,41707,Consumer Services,Real Estate Investment Trusts
RCC,Ready Capital Corporation,$25.24 ,25.24,,,United States,,134517,,
RCEL,Avita Therapeutics Inc. Common Stock,$25.04 ,-0.32,-1.26%,541447106,Australia,,120532,Health Care,Medical/Dental Instruments
RCG,RENN Fund Inc Common Stock,$2.30 ,-0.01,-0.43%,13689499,United States,,33632,,
RCHG,Recharge Acquisition Corp. Class A Common Stock,$10.29 ,-0.01,-0.10%,264967500,United States,2020,70309,Finance,Business Services
RCHGU,Recharge Acquisition Corp. Unit,$11.00 ,0.17,1.57%,0,United States,2020,21307,Finance,Business Services
RCHGW,Recharge Acquisition Corp. Warrant,$1.56 ,0.02,1.30%,0,United States,2020,75488,Finance,Business Services
RCI,Rogers Communication Inc. Common Stock,$45.19 ,-0.08,-0.18%,22817575120,Canada,,380061,Consumer Services,Television Services
RCII,Rent-A-Center Inc. Common Stock,$51.90 ,-1.5,-2.81%,2813278425,United States,1995,477638,Technology,Diversified Commercial Services
RCKT,Rocket Pharmaceuticals Inc. Common Stock,$54.26 ,-5.61,-9.37%,3286695538,United States,2015,917913,Health Care,Major Pharmaceuticals
RCKY,Rocky Brands Inc. Common Stock,$37.19 ,1.27,3.54%,269346009,United States,1993,121717,Consumer Non-Durables,Shoe Manufacturing
RCL,D/B/A Royal Caribbean Cruises Ltd. Common Stock,$74.20 ,6.57,9.72%,17613985253,United States,1993,9392697,Consumer Services,Marine Transportation
RCLFU,Rosecliff Acquisition Corp I Unit,$10.35 ,-0.05,-0.48%,0,United States,2021,1095017,Finance,Business Services
RCM,R1 RCM Inc. Common Stock,$30.58 ,0.19,0.63%,7962701736,United States,,891479,Consumer Services,Other Consumer Services
RCMT,RCM Technologies Inc. Common Stock,$5.20 ,-0.74,-12.46%,62160436,United States,,1428598,Technology,Professional Services
RCON,Recon Technology Ltd. Ordinary Shares,$2.85 ,0.13,4.78%,20528071,China,2009,1598784,Energy,Oilfield Services/Equipment
RCP,Ready Capital Corporation 6.50% Senior Notes due 2021,$25.20 ,0,0.00%,0,United States,2018,2334,Consumer Services,Real Estate Investment Trusts
RCS,PIMCO Strategic Income Fund Inc.,$7.13 ,0.03,0.42%,313263680,United States,1994,189345,,
RCUS,Arcus Biosciences Inc. Common Stock,$33.90 ,-2.1,-5.83%,2200900006,,2018,423503,Health Care,Major Pharmaceuticals
RDCM,Radcom Ltd. Ordinary Shares,$12.05 ,1.05,9.55%,168021055,Israel,1997,54980,Technology,Computer peripheral equipment
RDFI,Rareview Dynamic Fixed Income ETF,$27.67 ,-0.0916,-0.33%,,,2020,835,,
RDFN,Redfin Corporation Common Stock,$91.41 ,1.34,1.49%,9355266046,United States,2017,1411503,Finance,Real Estate
RDHL,Redhill Biopharma Ltd. American Depositary Shares,$10.40 ,0.7,7.22%,432503989,Israel,,1072282,Health Care,Major Pharmaceuticals
RDI,Reading International Inc Class A Common Stock,$6.50 ,-0.09,-1.37%,141369781,United States,,75157,Consumer Services,Movies/Entertainment
RDIB,Reading International Inc Class B Common Stock,$21.00 ,0,0.00%,456733137,United States,,52,Consumer Services,Movies/Entertainment
RDN,Radian Group Inc. Common Stock,$20.90 ,0.43,2.10%,4003532271,United States,,968920,Finance,Property-Casualty Insurers
RDNT,RadNet Inc. Common Stock,$18.56 ,-0.33,-1.75%,958365997,United States,,115945,Health Care,Medical Specialities
RDS/B,Royal Dutch Shell PLC,$38.09 ,1.51,4.13%,,Netherlands,,3071560,,
