Symbol,Name,Last Sale,Net Change,% Change,Market Cap,Country,IPO Year,Volume,Sector,Industry
A,Agilent Technologies Inc. Common Stock,$127.95 ,-0.03,-0.02%,39074567588,United States,1999,2130091,Capital Goods,Biotechnology: Laboratory Analytical Instruments
AA,Alcoa Corporation Common Stock ,$22.43 ,0.77,3.56%,4171488088,,2016,4256281,Basic Industries,Aluminum
AACG,ATA Creativity Global American Depositary Shares,$5.90 ,0.18,3.15%,184967956,China,,1546700,Consumer Services,Other Consumer Services
AACQ,Artius Acquisition Inc. Class A Common Stock,$14.00 ,2.73,24.22%,1267875000,United States,2020,14546784,Finance,Business Services
AACQU,Artius Acquisition Inc. Unit ,$15.34 ,3.24,26.78%,0,United States,2020,1107263,Finance,Business Services
AACQW,Artius Acquisition Inc Warrant,$3.97 ,1.47,58.80%,0,United States,2020,3352059,Finance,Business Services
AAIC,Arlington Asset Investment Corp Class A (new),$4.06 ,0.17,4.37%,135716409,United States,,536520,Consumer Services,Real Estate Investment Trusts
AAIC^B,Arlington Asset Investment Corp 7.00% ,$22.68 ,0.24,1.07%,,United States,,1120,,
AAIC^C,Arlington Asset Investment Corp 8.250% Seies C Fixed-to-Floating Rate Cumulative Redeemable Preferred Stock   ,$22.50 ,0.0998,0.45%,,United States,,10007,,
AAL,American Airlines Group Inc. Common Stock,$17.82 ,0.55,3.19%,11074765082,United States,,33503449,Transportation,Air Freight/Delivery Services
AAMC,Altisource Asset Management Corp Com,$25.00 ,-1.36,-5.16%,41255300,United States,,4298,Finance,Real Estate
AAME,Atlantic American Corporation Common Stock,$5.38 ,-0.33,-5.78%,109828821,United States,,558303,Finance,Life Insurance
AAN,Aarons Holdings Company Inc. Common Stock ,$20.26 ,0.29,1.45%,684352592,United States,2020,433998,Technology,Diversified Commercial Services
AAOI,Applied Optoelectronics Inc. Common Stock,$12.83 ,0.58,4.74%,294785236,United States,2013,745998,Technology,Semiconductors
AAON,AAON Inc. Common Stock,$76.81 ,-2.4,-3.03%,4012715317,United States,,155140,Capital Goods,Industrial Machinery/Components
AAP,Advance Auto Parts Inc Advance Auto Parts Inc W/I,$155.51 ,2.7,1.77%,10552059360,United States,,1932860,Consumer Services,Other Specialty Stores
AAPL,Apple Inc. Common Stock,$133.19 ,-2.18,-1.61%,2.30916E+12,United States,1980,80195696,Technology,Computer Manufacturing
AAT,American Assets Trust Inc. Common Stock,$29.19 ,-0.89,-2.96%,1765262068,United States,2011,501528,Consumer Services,Real Estate Investment Trusts
AAU,Almaden Minerals Ltd. Common Shares,$0.94 ,0.04,4.44%,113315694,Canada,2015,7315807,Basic Industries,Precious Metals
AAWW,Atlas Air Worldwide Holdings NEW Common Stock,$55.12 ,-1.02,-1.82%,1516753411,United States,,425522,Transportation,Transportation Services
AB,AllianceBernstein Holding L.P.  Units,$38.37 ,0.71,1.89%,3768814285,United States,,657713,Finance,Investment Managers
ABB,ABB Ltd Common Stock,$29.74 ,0.22,0.75%,60397008186,Switzerland,,1229151,Consumer Durables,Electrical Products
ABBV,AbbVie Inc. Common Stock,$104.20 ,-0.24,-0.23%,1.83962E+11,United States,2012,5629465,Health Care,Major Pharmaceuticals
ABC,AmerisourceBergen Corporation Common Stock,$103.37 ,-1.81,-1.72%,21160474726,United States,,807963,Health Care,Other Pharmaceuticals
ABCB,Ameris Bancorp Common Stock,$46.81 ,0.88,1.92%,3255236726,United States,1994,259599,Finance,Major Banks
ABCL,AbCellera Biologics Inc. Common Shares,$44.04 ,1.07,2.49%,11855029303,Canada,2020,1441084,Health Care,Major Pharmaceuticals
ABCM,Abcam plc American Depositary Shares,$23.77 ,0.02,0.08%,5388500858,United Kingdom,2020,40451,Health Care,Biotechnology: Biological Products (No Diagnostic Substances)
ABEO,Abeona Therapeutics Inc. Common Stock,$2.72 ,-0.24,-8.11%,267995407,United States,,7265934,Health Care,Major Pharmaceuticals
ABEV,Ambev S.A. American Depositary Shares (Each representing 1 Common Share),$2.88 ,0.09,3.23%,45316534461,,2013,18844680,Consumer Non-Durables,Beverages (Production/Distribution)
ABG,Asbury Automotive Group Inc Common Stock,$157.00 ,-0.99,-0.63%,3027831036,United States,2002,226112,Consumer Durables,Automotive Aftermarket
ABIO,ARCA biopharma Inc. Common Stock,$5.17 ,-0.01,-0.19%,48192000,United States,,1432682,Health Care,Biotechnology: In Vitro & In Vivo Diagnostic Substances
ABM,ABM Industries Incorporated Common Stock,$41.38 ,0.14,0.34%,2762473765,United States,,327425,Finance,Diversified Commercial Services
ABMD,ABIOMED Inc. Common Stock,$322.78 ,-5.58,-1.70%,14599651205,United States,,413199,Health Care,Medical/Dental Instruments
ABNB,Airbnb Inc. Class A Common Stock,$209.86 ,-2.82,-1.33%,1.2516E+11,United States,2020,3479432,Finance,Diversified Commercial Services
ABR,Arbor Realty Trust Common Stock,$15.85 ,0.5,3.26%,1955812161,United States,2004,1110279,Consumer Services,Real Estate Investment Trusts
ABR^A,Arbor Realty Trust Preferred Series A,$25.62 ,-0.04,-0.16%,,United States,,1650,,
ABR^B,Arbor Realty Trust Cumulative Redeemable Preferred Series B,$25.36 ,-0.0902,-0.35%,,United States,,900,,
ABR^C,Arbor Realty Trust Cumulative Redeemable Preferred Series C,$25.95 ,-0.0108,-0.04%,,United States,,3869,,
ABST,Absolute Software Corporation Common Stock,$15.90 ,0.26,1.66%,780956436,Canada,2020,191108,Technology,Computer Software: Prepackaged Software
ABT,Abbott Laboratories Common Stock,$128.02 ,-0.21,-0.16%,2.26898E+11,United States,,5173985,Health Care,Major Pharmaceuticals
ABTX,Allegiance Bancshares Inc. Common Stock,$36.65 ,0.09,0.25%,749401242,United States,2015,39313,Finance,Major Banks
ABUS,Arbutus Biopharma Corporation Common Stock,$4.49 ,0.16,3.70%,381242568,Canada,,2356312,Health Care,Major Pharmaceuticals
AC,Associated Capital Group Inc. Common Stock,$35.52 ,-0.45,-1.25%,792278786,United States,2015,12535,Finance,Investment Bankers/Brokers/Service
ACA,Arcosa Inc. Common Stock ,$65.05 ,0.48,0.74%,3139792093,,2018,199819,Capital Goods,Metal Fabrications
ACAC,Acies Acquisition Corp. Class A Ordinary Share,$10.58 ,-0.34,-3.11%,284668125,United States,2020,633771,Finance,Business Services
ACACU,Acies Acquisition Corp. Unit,$11.52 ,-0.22,-1.87%,0,United States,2020,75017,Finance,Business Services
ACACW,Acies Acquisition Corp. Warrant,$2.59 ,-0.0655,-2.47%,0,United States,2020,219934,Finance,Business Services
ACAD,ACADIA Pharmaceuticals Inc. Common Stock,$49.12 ,-1.01,-2.02%,7809003633,United States,2004,1038588,Health Care,Major Pharmaceuticals
ACB,Aurora Cannabis Inc. Common Shares,$14.09 ,1.61,12.90%,2781236640,,2018,31350186,Consumer Durables,Specialty Chemicals
ACBI,Atlantic Capital Bancshares Inc. Common Stock,$19.32 ,0.08,0.42%,394029700,United States,,79350,Finance,Major Banks
ACC,American Campus Communities Inc Common Stock,$43.23 ,-0.23,-0.53%,5949835294,United States,2004,916969,Consumer Services,Real Estate Investment Trusts
ACCD,Accolade Inc. Common Stock,$53.76 ,0.99,1.88%,2974066583,United States,2020,731360,,
ACCO,Acco Brands Corporation Common Stock,$8.83 ,-0.17,-1.89%,834407071,United States,,312137,Consumer Durables,Publishing
ACEL,Accel Entertainment Inc. ,$10.71 ,-0.04,-0.37%,1036544548,United States,2017,122751,Consumer Services,Services-Misc. Amusement & Recreation
ACER,Acer Therapeutics Inc. Common Stock (DE),$3.81 ,-0.03,-0.78%,54522030,United States,,435827,Health Care,Major Pharmaceuticals
ACET,Adicet Bio Inc. Common Stock ,$16.75 ,-0.07,-0.42%,328129619,United States,2018,272589,Health Care,Major Pharmaceuticals
ACEV,ACE Convergence Acquisition Corp. Class A Ordinary Shares,$12.83 ,0.33,2.64%,368862500,United States,2020,2088554,Technology,Semiconductors
ACEVU,ACE Convergence Acquisition Corp. Unit,$14.53 ,0.566,4.05%,0,United States,2020,13549,Technology,Semiconductors
ACEVW,ACE Convergence Acquisition Corp. Warrant,$3.18 ,0.475,17.56%,0,United States,2020,730589,Technology,Semiconductors
ACGL,Arch Capital Group Ltd. Common Stock,$34.91 ,-0.24,-0.68%,14198617612,Bermuda,,1970460,Finance,Property-Casualty Insurers
ACGLO,Arch Capital Group Ltd. Depositary Shares Each Representing 1/1000th Interest in a Share of 5.45% Non-Cumulative Preferred Shares Series F,$26.03 ,-0.11,-0.42%,0,Bermuda,,37213,Finance,Property-Casualty Insurers
ACGLP,Arch Capital Group Ltd. Depositary Shares Representing Interest in 5.25% Non-Cumulative Preferred Series E Shrs,$25.51 ,-0.04,-0.16%,0,Bermuda,,37278,Finance,Property-Casualty Insurers
ACH,Aluminum Corporation of China Limited American Depositary Shares,$9.69 ,0.89,10.11%,6597988035,China,2001,215686,Basic Industries,Aluminum
ACHC,Acadia Healthcare Company Inc. Common Stock,$52.06 ,-1.07,-2.01%,4632884579,United States,,470434,Health Care,Medical Specialities
ACHV,Achieve Life Sciences Inc. Common Shares,$15.16 ,-0.61,-3.87%,92326886,United States,,137673,Health Care,Biotechnology: In Vitro & In Vivo Diagnostic Substances
ACI,Albertsons Companies Inc. Class A Common Stock,$16.47 ,-0.02,-0.12%,7667332759,United States,2020,2575168,Consumer Services,Food Chains
ACIA,Acacia Communications Inc. Common Stock,$114.83 ,-0.03,-0.03%,4892724869,United States,2016,1182371,Technology,Semiconductors
ACIC,Atlas Crest Investment Corp. Class A Common Stock,$14.14 ,0.58,4.28%,883750000,United States,2020,8002762,Finance,Business Services
ACIU,AC Immune SA Common Stock,$7.92 ,-0.27,-3.30%,568190977,Switzerland,2016,1171261,Health Care,Major Pharmaceuticals
ACIW,ACI Worldwide Inc. Common Stock,$41.35 ,0.03,0.07%,4828089307,United States,,446178,Technology,Computer Software: Prepackaged Software
ACKIT,Ackrell SPAC Partners I Co. Subunits,$10.21 ,-0.01,-0.10%,0,United States,2021,26413,Finance,Business Services
ACKIU,Ackrell SPAC Partners I Co. Units,$10.71 ,0.0101,0.09%,0,United States,2020,36483,Finance,Business Services
ACKIW,Ackrell SPAC Partners I Co. Warrants,$1.11 ,0.035,3.27%,0,United States,2021,397655,Finance,Business Services
ACLS,Axcelis Technologies Inc. Common Stock,$40.45 ,0.69,1.74%,1360454850,United States,2000,367698,Technology,Industrial Machinery/Components
ACM,AECOM Common Stock,$57.70 ,1.68,3.00%,8526589631,United States,2007,2001762,Consumer Services,Military/Government/Technical
ACMR,ACM Research Inc. Class A Common Stock,$139.98 ,4.75,3.51%,2584706064,United States,2017,383310,Technology,Industrial Machinery/Components
ACN,Accenture plc Class A Ordinary Shares (Ireland),$257.05 ,-0.42,-0.16%,1.7008E+11,Ireland,2001,1606470,Miscellaneous,Business Services
ACNB,ACNB Corporation Common Stock,$27.00 ,0.44,1.66%,234989451,United States,,79572,Finance,Major Banks
ACND,Ascendant Digital Acquisition Corp. Class A Ordinary Shares,$11.01 ,-0.025,-0.23%,569508750,United States,2020,61386,Finance,Business Services
ACOR,Acorda Therapeutics Inc. Common Stock,$7.45 ,-0.08,-1.06%,70650108,United States,2006,436228,Health Care,Biotechnology: Biological Products (No Diagnostic Substances)
ACP,Aberdeen Income Credit Strategies Fund Common Shares,$11.28 ,0.09,0.80%,196634043,United States,2011,139242,,
ACRE,Ares Commercial Real Estate Corporation Common Stock,$13.63 ,0.52,3.97%,455813601,United States,2012,388767,Consumer Services,Real Estate Investment Trusts
ACRS,Aclaris Therapeutics Inc. Common Stock,$23.93 ,-0.28,-1.16%,1208804208,United States,2015,590527,Health Care,Major Pharmaceuticals
ACRX,AcelRx Pharmaceuticals Inc. Common Stock,$2.30 ,-0.21,-8.37%,261765176,United States,2011,10767974,Health Care,Major Pharmaceuticals
ACST,Acasti Pharma Inc. Class A Common Stock,$1.10 ,0.07,6.80%,106581791,Canada,,59623775,Health Care,Major Pharmaceuticals
ACTC,ArcLight Clean Transition Corp. Class A Ordinary Shares,$24.95 ,-0.07,-0.28%,865453125,United States,2020,2235931,Capital Goods,Auto Manufacturing
ACTCU,ArcLight Clean Transition Corp. Unit,$28.98 ,-0.52,-1.76%,0,United States,2020,10630,Capital Goods,Auto Manufacturing
ACTCW,ArcLight Clean Transition Corp. Warrant,$8.05 ,-0.07,-0.86%,0,United States,2020,602778,Capital Goods,Auto Manufacturing
ACTG,Acacia Research Corporation (Acacia Tech) Common Stock,$7.86 ,-0.14,-1.75%,387336501,United States,,1426238,Miscellaneous,Multi-Sector Companies
ACU,Acme United Corporation. Common Stock,$33.33 ,0.075,0.23%,111269276,United States,1988,5870,Capital Goods,Industrial Machinery/Components
ACV,Virtus AllianzGI Diversified Income & Convertible Fund Common Shares of Beneficial Interest,$35.90 ,0.24,0.67%,371705728,United States,2015,36835,,
ACY,AeroCentury Corp. Common Stock,$10.83 ,0.33,3.14%,16741924,United States,,99015,Technology,Diversified Commercial Services
ADAG,Adagene Inc. American Depositary Shares,$25.56 ,-2.1,-7.59%,1078116199,China,2021,186226,Health Care,Major Pharmaceuticals
ADAP,Adaptimmune Therapeutics plc American Depositary Shares,$6.77 ,0.25,3.83%,1047852232,United Kingdom,2015,1931229,Health Care,Biotechnology: Biological Products (No Diagnostic Substances)
ADBE,Adobe Inc. Common Stock,$501.64 ,2.8,0.56%,2.40135E+11,United States,1986,1845904,Technology,Computer Software: Prepackaged Software
ADC,Agree Realty Corporation Common Stock,$64.51 ,-0.56,-0.86%,4065515868,United States,,497380,Consumer Services,Real Estate Investment Trusts
ADCT,ADC Therapeutics SA Common Shares,$31.43 ,0.96,3.15%,2411267107,,2020,183954,Health Care,Major Pharmaceuticals
ADERU,26 Capital Acquisition Corp. Unit,$10.74 ,-0.06,-0.56%,0,United States,2021,227540,Finance,Business Services
ADES,Advanced Emissions Solutions Inc. Common Stock,$6.01 ,0.32,5.62%,111472801,United States,,259231,Basic Industries,Major Chemicals
ADFI,Anfield Dynamic Fixed Income ETF,$9.81 ,-0.05,-0.51%,,,2020,82,,
ADI,Analog Devices Inc. Common Stock,$160.49 ,-0.29,-0.18%,59285577665,United States,,3170586,Technology,Semiconductors
ADIL,Adial Pharmaceuticals Inc Common Stock,$3.19 ,0.17,5.63%,48274525,United States,2018,741079,Health Care,Major Pharmaceuticals
ADILW,Adial Pharmaceuticals Inc Warrant,$0.85 ,0.115,15.65%,0,United States,2018,23463,Health Care,Major Pharmaceuticals
ADM,Archer-Daniels-Midland Company Common Stock,$56.05 ,0.33,0.59%,31169643829,United States,,2788607,Consumer Non-Durables,Packaged Foods
ADMA,ADMA Biologics Inc Common Stock,$2.65 ,-0.14,-5.02%,250552338,United States,,4340648,Health Care,Biotechnology: Biological Products (No Diagnostic Substances)
ADME,Aptus Drawdown Managed Equity ETF,$36.96 ,-0.06,-0.16%,,United States,2016,34440,,
ADMP,Adamis Pharmaceuticals Corporation Common Stock,$1.57 ,0.02,1.29%,220238421,United States,,14408033,Health Care,Major Pharmaceuticals
ADMS,Adamas Pharmaceuticals Inc. Common Stock,$6.05 ,0.13,2.20%,172549140,United States,2014,1202952,Health Care,Major Pharmaceuticals
ADN,Advent Technologies Holdings Inc. Class A Common Stock,$14.22 ,-0.93,-6.14%,290631318,United States,2018,903432,Miscellaneous,Industrial Machinery/Components
ADNT,Adient plc Ordinary Shares ,$36.96 ,-0.04,-0.11%,3480527229,,2016,1060447,Capital Goods,Auto Parts:O.E.M.
ADNWW,Advent Technologies Holdings Inc. Warrant,$2.75 ,-0.2348,-7.88%,0,United States,2018,959339,Miscellaneous,Industrial Machinery/Components
ADOC,Edoc Acquisition Corp. Class A Ordinary Share,$10.20 ,0.04,0.39%,123843300,United States,2020,10576,Finance,Business Services
ADOCR,Edoc Acquisition Corp. Right,$0.60 ,0.04,7.14%,0,United States,2020,18086,Finance,Business Services
ADOCW,Edoc Acquisition Corp. Warrant,$0.75 ,-0.0249,-3.21%,0,United States,2020,24524,Finance,Business Services
ADP,Automatic Data Processing Inc. Common Stock,$166.16 ,-0.87,-0.52%,71106546955,United States,,2024423,Technology,EDP Services
ADPT,Adaptive Biotechnologies Corporation Common Stock,$64.21 ,-2.29,-3.44%,8782156896,United States,2019,521377,Health Care,Biotechnology: Biological Products (No Diagnostic Substances)
ADS,Alliance Data Systems Corporation Common Stock,$87.11 ,3.93,4.73%,4322553604,United States,2001,1210903,Miscellaneous,Business Services
ADSK,Autodesk Inc. Common Stock,$308.22 ,3.08,1.01%,67774311793,United States,,1571840,Technology,Computer Software: Prepackaged Software
ADT,ADT Inc. Common Stock,$9.33 ,0,0.00%,7701525249,United States,2018,2895326,Consumer Services,Diversified Commercial Services
ADTN,ADTRAN Inc. Common Stock,$16.25 ,-0.19,-1.16%,779288575,United States,1994,254428,Public Utilities,Telecommunications Equipment
ADTX,ADiTx Therapeutics Inc. Common Stock,$4.51 ,-0.04,-0.88%,63022280,United States,2020,1280285,Health Care,Major Pharmaceuticals
ADUS,Addus HomeCare Corporation Common Stock,$121.49 ,-1.68,-1.36%,1920599935,United States,2009,65946,Health Care,Medical/Nursing Services
ADV,Advantage Solutions Inc. Class A Common Stock,$10.00 ,0,0.00%,3134251820,United States,2019,678052,Miscellaneous,Business Services
ADVM,Adverum Biotechnologies Inc. Common Stock,$13.44 ,0.01,0.07%,1310098984,United States,2014,564365,Health Care,Biotechnology: Biological Products (No Diagnostic Substances)
ADVWW,Advantage Solutions Inc. Warrant,$1.85 ,0.05,2.78%,0,United States,2019,64963,Miscellaneous,Business Services
ADX,Adams Diversified Equity Fund Inc.,$18.07 ,0.03,0.17%,1963908532,United States,,127008,,
ADXN,Addex Therapeutics Ltd American Depositary Shares,$12.09 ,0.57,4.95%,68143085,Switzerland,,175619,Health Care,Major Pharmaceuticals
ADXS,Advaxis Inc. Common Stock,$1.13 ,0.05,4.63%,126528007,United States,,10018677,Health Care,Major Pharmaceuticals
AE,Adams Resources & Energy Inc. Common Stock,$27.95 ,0.2,0.72%,118571838,United States,,6104,Energy,Oil Refining/Marketing
AEACU,Authentic Equity Acquisition Corp. Unit,$10.43 ,-0.005,-0.05%,0,United States,2021,170203,Finance,Business Services
AEB,AEGON N.V. Perp. Cap. Secs. Floating Rate (Netherlands),$25.06 ,-0.08,-0.32%,0,Netherlands,,51676,Finance,Life Insurance
AEE,Ameren Corporation Common Stock,$72.66 ,-0.62,-0.85%,17962059021,United States,,1660445,Public Utilities,Power Generation
AEF,Aberdeen Emerging Markets Equity Income Fund Inc. Common Stock,$8.99 ,0.02,0.22%,456258484,United States,,94600,,
AEFC,Aegon Funding Company LLC 5.10% Subordinated Notes due 2049,$25.59 ,-0.16,-0.62%,0,,2019,54677,Finance,Life Insurance
AEG,AEGON N.V. Common Stock,$4.64 ,0.15,3.34%,9412329900,Netherlands,,1473982,Finance,Life Insurance
AEGN,Aegion Corp Common Stock,$26.57 ,5.12,23.87%,817634678,United States,,3900798,Basic Industries,Water Supply
AEHL,Antelope Enterprise Holdings Limited Common Stock (0.024 par),$3.60 ,0.05,1.41%,10980324,China,,1222377,Capital Goods,Building Materials
AEHR,Aehr Test Systems Common Stock,$3.26 ,0.13,4.15%,76582381,United States,1997,608121,Capital Goods,Electrical Products
AEI,Alset EHome International Inc. Common Stock,$27.50 ,9.94,56.61%,235675000,United States,2020,1598156,Finance,Real Estate
AEIS,Advanced Energy Industries Inc. Common Stock,$111.00 ,1.97,1.81%,4248271365,United States,1995,348519,Capital Goods,Industrial Machinery/Components
AEL,American Equity Investment Life Holding Company Common Stock,$29.94 ,0.12,0.40%,2970738866,United States,2003,438988,Finance,Life Insurance
AEL^A,American Equity Investment Life Holding Company Depositary Shares each representing a 1/1000th interest in a share of 5.95% Fixed-Rate Reset Non-Cumulative Preferred Stock Series A,$26.02 ,0.1,0.39%,,United States,,33242,,
AEL^B,American Equity Investment Life Holding Company Depositary Shares each representing a 1/1000th interest in a share of 6.625% Fixed-Rate Reset Non-Cumulative Preferred Stock Series B,$26.84 ,0.08,0.30%,,United States,,18902,,
AEM,Agnico Eagle Mines Limited Common Stock,$63.87 ,-2.81,-4.21%,15478918707,Canada,,2463118,Basic Industries,Precious Metals
AEMD,Aethlon Medical Inc. Common Stock,$2.61 ,-0.16,-5.78%,31642398,United States,,779458,Health Care,Medical/Dental Instruments
AENZ,Aenza S.A.A. American Depositary Shares,$2.28 ,0.04,1.79%,397594542,,2018,12526,Basic Industries,Military/Government/Technical
AEO,American Eagle Outfitters Inc. Common Stock,$25.30 ,0.68,2.76%,4204457932,United States,,2647953,Consumer Services,Clothing/Shoe/Accessory Stores
AEP,American Electric Power Company Inc. Common Stock,$78.19 ,-0.42,-0.53%,38812697663,United States,,2232594,Public Utilities,Electric Utilities: Central
AEPPL,American Electric Power Company Inc. Corporate Unit,$46.58 ,-0.03,-0.06%,0,United States,,97046,Public Utilities,Electric Utilities: Central
AEPPZ,American Electric Power Company Inc. Corporate Units,$47.19 ,-0.23,-0.49%,0,United States,,16015,Public Utilities,Electric Utilities: Central
AER,AerCap Holdings N.V. Ordinary Shares,$43.50 ,-0.12,-0.28%,5644412666,Netherlands,2006,1219208,Technology,Diversified Commercial Services
AERI,Aerie Pharmaceuticals Inc. Common Stock,$16.95 ,0.54,3.29%,793510741,United States,2013,725342,Health Care,Biotechnology: Biological Products (No Diagnostic Substances)
AES,The AES Corporation Common Stock,$28.91 ,0.38,1.33%,19228941489,United States,,7370036,Basic Industries,Electric Utilities: Central
AESE,Allied Esports Entertainment Inc. Common Stock,$2.61 ,-0.23,-8.10%,102154100,United States,2017,1859058,Consumer Services,Services-Misc. Amusement & Recreation
AESR,Anfield U.S. Equity Sector Rotation ETF,$12.47 ,0.0132,0.11%,,,2019,40475,,
AEY,ADDvantage Technologies Group Inc. Common Stock,$3.37 ,0.03,0.90%,40545751,United States,,123925,Consumer Services,Office Equipment/Supplies/Services
AEYE,AudioEye Inc. Common Stock,$40.84 ,-1.41,-3.34%,420096331,United States,,167967,Technology,Computer Software: Prepackaged Software
AEZS,Aeterna Zentaris Inc. Common Stock,$1.81 ,-0.09,-4.74%,113448290,Canada,,10795935,Health Care,Major Pharmaceuticals
AFB,AllianceBernstein National Municipal Income Fund Inc,$14.51 ,0.08,0.55%,417089021,United States,2002,79768,,
AFBI,Affinity Bancshares Inc. Common Stock (MD),$11.07 ,0.17,1.56%,0,United States,2017,14378,Finance,Savings Institutions
AFC,Allied Capital Corporation Allied Capital Corporation 6.875% Notes due April 15 2047,$25.56 ,-0.19,-0.74%,0,United States,,20165,,
AFG,American Financial Group Inc. Common Stock,$108.17 ,0.13,0.12%,9339938650,United States,,457724,Finance,Property-Casualty Insurers
AFGB,American Financial Group Inc. 5.875% Subordinated Debentures due 2059,$27.01 ,-0.03,-0.11%,0,United States,2019,16576,Finance,Property-Casualty Insurers
AFGC,American Financial Group Inc. 5.125% Subordinated Debentures due 2059,$26.55 ,-0.22,-0.82%,26498493,United States,2019,12475,Finance,Property-Casualty Insurers
AFGD,American Financial Group Inc. 5.625% Subordinated Debentures due 2060,$27.03 ,-0.25,-0.92%,0,United States,2020,17027,Finance,Property-Casualty Insurers
AFGE,American Financial Group Inc. 4.500% Subordinated Debentures due 2060,$26.32 ,-0.2,-0.75%,0,United States,2020,9164,Finance,Property-Casualty Insurers
AFI,Armstrong Flooring Inc. Common Stock,$4.76 ,-0.16,-3.25%,102940817,,2016,399034,Consumer Non-Durables,Plastic Products
AFIB,Acutus Medical Inc. Common Stock,$24.24 ,0.36,1.51%,674989052,United States,2020,230338,Health Care,Medical/Dental Instruments
AFIN,American Finance Trust Inc. Class A Common Stock,$8.55 ,0.13,1.54%,930558137,United States,,676344,Consumer Services,Real Estate Investment Trusts
AFINO,American Finance Trust Inc. 7.375% Series C Cumulative Redeemable Preferred Stock,$25.10 ,0.0999,0.40%,,United States,,14385,Consumer Services,Real Estate Investment Trusts
AFINP,American Finance Trust Inc. 7.50% Series A Cumulative Redeemable Perpetual Preferred Stock,$25.29 ,0.1125,0.45%,0,United States,,9424,Consumer Services,Real Estate Investment Trusts
AFL,AFLAC Incorporated Common Stock,$46.35 ,-0.57,-1.22%,32095242900,United States,,3853024,Finance,Accident &Health Insurance
AFMD,Affimed N.V.,$6.18 ,0.09,1.48%,709379594,Germany,2014,899964,Health Care,Major Pharmaceuticals
AFRM,Affirm Holdings Inc. Class A Common Stock,$119.15 ,-6.74,-5.35%,29362941265,United States,2021,5633151,Miscellaneous,Business Services
AFT,Apollo Senior Floating Rate Fund Inc. Common Stock,$14.63 ,-0.07,-0.48%,227833882,,2011,84794,,
AFYA,Afya Limited Class A Common Shares,$23.65 ,0.01,0.04%,2204246764,Brazil,2019,242949,Consumer Services,Other Consumer Services
AG,First Majestic Silver Corp. Ordinary Shares (Canada),$17.51 ,0.1,0.57%,3873871899,Canada,,6865845,Basic Industries,Precious Metals
AGBA,AGBA Acquisition Limited Ordinary Share,$10.52 ,-0.035,-0.33%,62827125,Hong Kong,2019,2352,Finance,Business Services
AGBAR,AGBA Acquisition Limited Right,$0.54 ,0.04,8.00%,0,Hong Kong,2019,8329,Finance,Business Services
AGBAU,AGBA Acquisition Limited Unit,$11.40 ,0,0.00%,0,Hong Kong,2019,1,Finance,Business Services
AGBAW,AGBA Acquisition Limited Warrant,$0.70 ,0,0.00%,0,Hong Kong,2019,41612,Finance,Business Services
AGC,Altimeter Growth Corp. Class A Ordinary Shares,$13.88 ,0.01,0.07%,867500000,United States,2020,120035,Finance,Business Services
AGCB,Altimeter Growth Corp. 2 Class A Ordinary Shares,$13.11 ,0.37,2.90%,751858500,,2021,726732,Finance,Business Services
AGCO,AGCO Corporation Common Stock,$117.65 ,-0.95,-0.80%,8811927587,United States,,699786,Capital Goods,Industrial Machinery/Components
AGCUU,Altimeter Growth Corp. Unit,$15.24 ,0.39,2.63%,0,United States,2020,93770,Finance,Business Services
AGCWW,Altimeter Growth Corp. Warrant,$4.35 ,-0.4,-8.42%,0,United States,2020,98345,Finance,Business Services
AGD,Aberdeen Global Dynamic Dividend Fund,$11.17 ,-0.01,-0.09%,140178831,United States,2006,33301,,
AGE,AgeX Therapeutics Inc. Common Stock,$2.46 ,-0.01,-0.41%,92719976,,2018,339801,Health Care,Major Pharmaceuticals
AGEN,Agenus Inc. Common Stock,$4.60 ,-0.04,-0.86%,874686785,United States,2000,2427499,Health Care,Biotechnology: Biological Products (No Diagnostic Substances)
AGFS,AgroFresh Solutions Inc. Common Stock,$2.60 ,0.07,2.77%,137942896,United States,2014,143711,Basic Industries,Agricultural Chemicals
AGFY,Agrify Corporation Common Stock,$16.01 ,-2.93,-15.47%,216003558,United States,2021,1050479,Consumer Non-Durables,Farming/Seeds/Milling
AGI,Alamos Gold Inc. Class A Common Shares,$8.07 ,-0.08,-0.98%,3169312297,Canada,2015,2242298,Basic Industries,Precious Metals
AGIO,Agios Pharmaceuticals Inc. Common Stock,$54.37 ,-1.52,-2.72%,3768051031,United States,2013,727985,Health Care,Major Pharmaceuticals
