Symbol,Name,Last Sale,Net Change,% Change,Market Cap,Country,IPO Year,Volume,Sector,Industry
ITHXU,ITHAX Acquisition Corp. Unit,$10.43 ,-0.0097,-0.09%,0,United States,2021,7921,Finance,Business Services
ITI,Iteris Inc. Common Stock,$6.17 ,0.02,0.33%,256922453,United States,,153151,Capital Goods,Telecommunications Equipment
ITIC,Investors Title Company Common Stock,$162.00 ,-0.25,-0.15%,306570582,United States,,5801,Finance,Specialty Insurers
ITMR,Itamar Medical Ltd. American Depository Shares,$25.58 ,0.43,1.71%,419026031,Israel,,19460,Health Care,Medical/Dental Instruments
ITOS,iTeos Therapeutics Inc. Common Stock,$37.42 ,1.42,3.94%,1311374844,United States,2020,107851,Health Care,Biotechnology: Biological Products (No Diagnostic Substances)
ITP,IT Tech Packaging Inc. Common Stock,$1.44 ,0.35,32.11%,78793393,China,,42683492,Consumer Durables,Containers/Packaging
ITQRU,Itiquira Acquisition Corp. Unit,$10.39 ,-0.02,-0.19%,0,United States,2021,6264,Finance,Business Services
ITRG,Integra Resources Corp. Common Shares,$3.45 ,-0.0799,-2.26%,188398211,,,140374,Basic Industries,Precious Metals
ITRI,Itron Inc. Common Stock,$103.90 ,0.22,0.21%,4197238845,United States,1993,341698,Capital Goods,Electrical Products
ITRM,Iterum Therapeutics plc Ordinary Share,$2.11 ,-0.15,-6.64%,255626310,Ireland,2018,38495111,Health Care,Major Pharmaceuticals
ITRN,Ituran Location and Control Ltd. Ordinary Shares,$22.82 ,0.27,1.20%,535709335,Israel,2005,54383,Technology,Electronic Components
ITT,ITT Inc. Common Stock ,$79.15 ,0.06,0.08%,6838560000,United States,2011,624856,Capital Goods,Fluid Controls
ITUB,Itau Unibanco Banco Holding SA American Depositary Shares (Each repstg 500 Preferred shares),$5.18 ,0.01,0.19%,50569526721,Brazil,,14769198,Finance,Major Banks
ITW,Illinois Tool Works Inc. Common Stock,$199.03 ,-1.95,-0.97%,62997027547,United States,,1009508,Technology,Industrial Machinery/Components
IVA,Inventiva S.A. American Depository Shares,$16.70 ,-0.15,-0.89%,640923455,France,2020,35560,Health Care,Major Pharmaceuticals
IVAC,Intevac Inc. Common Stock,$6.83 ,0.09,1.34%,162920245,United States,1995,67173,Technology,Industrial Machinery/Components
IVC,Invacare Corporation Common Stock,$8.95 ,0.37,4.31%,308041503,United States,,347357,Health Care,Industrial Specialties
IVDG,Invesco Focused Discovery Growth ETF,$13.27 ,-0.0149,-0.11%,,United States,2020,2071,,
IVH,Ivy High Income Opportunities Fund Common Shares of Beneficial Interest,$13.41 ,-0.02,-0.15%,222206851,,2013,41280,,
IVLC,Invesco US Large Cap Core ESG ETF,$12.46 ,-0.0207,-0.17%,,United States,2020,127,,
IVR,INVESCO MORTGAGE CAPITAL INC Common Stock,$3.76 ,-0.07,-1.83%,867891126,United States,2009,9432914,Consumer Services,Real Estate Investment Trusts
IVR^A,Invesco Mortgage Capital Inc. Pfd Ser A,$24.53 ,0,0.00%,,United States,,11672,,
IVR^B,Invesco Mortgage Capital Inc. Preferred Series B Cum Fxd to Fltg,$24.31 ,-0.01,-0.04%,,United States,,21722,,
IVR^C,INVESCO MORTGAGE CAPITAL INC 7.5% Fixed-to-Floating Series C Cumulative Redeemable Preferred Stock Liquation Preference $25.00 per Share,$24.54 ,0.15,0.62%,,United States,,24358,,
IVRA,Invesco Real Assets ESG ETF,$12.52 ,0.0005,0.00%,,United States,2020,4865,,
IVSG,Invesco Select Growth ETF,$13.23 ,0.0298,0.23%,,United States,2020,2599,,
IVZ,Invesco Ltd Common Stock,$22.84 ,0.17,0.75%,10491213981,United States,,1909372,Finance,Investment Managers
IX,Orix Corp Ads Common Stock,$84.93 ,0.21,0.25%,20714301643,Japan,,26454,Finance,Diversified Financial Services
IZEA,IZEA Worldwide Inc. Common Stock,$5.02 ,0.24,5.02%,273654843,United States,,5648972,Consumer Services,Advertising
J,Jacobs Engineering Group Inc. Common Stock,$113.23 ,-1.67,-1.45%,14729656010,United States,,583041,Basic Industries,Military/Government/Technical
JACK,Jack In The Box Inc. Common Stock,$101.11 ,0.57,0.57%,2318363930,United States,,278527,Consumer Services,Restaurants
JAGX,Jaguar Health Inc. Common Stock,$2.86 ,0,0.00%,336953766,United States,2015,10391054,Health Care,Major Pharmaceuticals
JAKK,JAKKS Pacific Inc. Common Stock,$9.75 ,0.655,7.20%,48242201,United States,1996,158539,Consumer Non-Durables,Recreational Products/Toys
JAMF,Jamf Holding Corp. Common Stock,$39.91 ,-0.07,-0.18%,4653361725,United States,2020,380603,Technology,Computer Software: Prepackaged Software
JAN,JanOne Inc. Common Stock (NV),$9.05 ,0.18,2.03%,21732761,United States,,414364,Consumer Services,Home Furnishings
JAX,J. Alexander's Holdings Inc. Common Stock,$8.29 ,-0.05,-0.60%,124930938,,2015,78773,Consumer Services,Restaurants
JAZZ,Jazz Pharmaceuticals plc Common Stock (Ireland),$166.49 ,-1.03,-0.62%,9275824859,Ireland,2007,672140,Health Care,Major Pharmaceuticals
JBGS,JBG SMITH Properties Common Shares ,$32.08 ,-0.68,-2.08%,4249467640,United States,2017,282904,Consumer Services,Real Estate Investment Trusts
JBHT,J.B. Hunt Transport Services Inc. Common Stock,$146.32 ,-2,-1.35%,15459293280,United States,,769325,Transportation,Trucking Freight/Courier Services
JBK,Lehman ABS 3.50 3.50% Adjustable Corp Backed Tr Certs GS Cap I,$28.75 ,0.1399,0.49%,0,United States,,1015,Finance,Finance: Consumer Services
JBL,Jabil Inc. Common Stock,$45.44 ,0.73,1.63%,6823997395,United States,1993,509508,Technology,Electrical Products
JBLU,JetBlue Airways Corporation Common Stock,$16.73 ,0.28,1.70%,5260893198,United States,2002,9609660,Transportation,Air Freight/Delivery Services
JBSS,John B. Sanfilippo & Son Inc. Common Stock,$90.43 ,-0.54,-0.59%,1036871556,United States,1991,46151,Consumer Non-Durables,Specialty Foods
JBT,John Bean Technologies Corporation Common Stock,$132.35 ,2.39,1.84%,4199359752,United States,,181319,Technology,Industrial Machinery/Components
JCE,Nuveen Core Equity Alpha Fund Nuveen Core Equity Alpha Fund Common Shares of Beneficial Interest,$14.61 ,0.01,0.07%,234187795,United States,2007,27849,,
JCI,Johnson Controls International plc Ordinary Share,$53.00 ,-0.58,-1.08%,38073679324,Switzerland,,4050628,Consumer Services,Other Consumer Services
JCICU,Jack Creek Investment Corp. Units,$10.55 ,0.065,0.62%,0,United States,2021,35114,Finance,Business Services
JCO,Nuveen Credit Opportunities 2022 Target Term Fund Common Shares of Beneficial Interest,$8.31 ,-0.01,-0.12%,230527153,United States,2017,61645,,
JCOM,j2 Global Inc. Common Stock,$110.87 ,3.08,2.86%,4962384097,United States,1999,523547,Technology,Telecommunications Equipment
JCS,Communications Systems Inc. Common Stock,$5.80 ,0.39,7.21%,54058755,United States,,21870,Public Utilities,Telecommunications Equipment
JCTCF,Jewett-Cameron Trading Company Common Shares,$10.38 ,0.1077,1.05%,36217491,United States,,5919,Consumer Services,RETAIL: Building Materials
JD,JD.com Inc. American Depositary Shares,$103.43 ,4.12,4.15%,1.60304E+11,China,2014,10793919,Consumer Services,Other Specialty Stores
JDD,Nuveen Diversified Dividend and Income Fund Shares of Beneficial Interest,$9.04 ,0,0.00%,178418114,United States,2003,42686,,
JE,Just Energy Group Inc. Ordinary Shares (Canada),$6.17 ,-0.99,-13.83%,296476700,Canada,,6005394,Public Utilities,Oil/Gas Transmission
JEF,Jefferies Financial Group Inc. Common Stock,$29.06 ,0.19,0.66%,7296122388,United States,,3492952,Finance,Investment Bankers/Brokers/Service
JELD,JELD-WEN Holding Inc. Common Stock,$27.11 ,-1.44,-5.04%,2731378560,United States,2017,519246,Basic Industries,Forest Products
JEMD,Nuveen Emerging Markets Debt 2022 Target Term Fund Common Shares of Beneficial Interest $0.01 par value per share,$7.78 ,-0.1,-1.27%,110828146,,2017,30417,,
JEQ,Aberdeen Japan Equity Fund Inc.  Common Stock,$9.80 ,0,0.00%,131403653,United States,1992,50652,,
JFIN,Jiayin Group Inc. American Depositary Shares,$5.26 ,0.67,14.60%,284171500,China,2019,697054,Finance,Finance: Consumer Services
JFR,Nuveen Floating Rate Income Fund Common Stock,$9.23 ,-0.08,-0.86%,525357460,United States,2004,310431,,
JFU,9F Inc. American Depositary Shares,$2.29 ,0.25,12.26%,446987390,China,2019,4143724,Finance,Finance: Consumer Services
JG,Aurora Mobile Limited American Depositary Shares,$6.71 ,0.6,9.82%,776501511,China,2018,4836511,Technology,Computer Software: Programming Data Processing
JGH,Nuveen Global High Income Fund Common Shares of Beneficial Interest,$15.60 ,-0.1,-0.64%,361567331,United States,2014,42871,,
JHAA,Nuveen Corporate Income 2023 Target Term Fund,$9.89 ,-0.02,-0.20%,77383553,,2018,36070,,
JHB,Nuveen Corporate Income November 2021 Target Term Fund,$9.37 ,0,0.00%,523783459,,2016,135531,,
JHG,Janus Henderson Group plc Ordinary Shares,$30.37 ,0.43,1.44%,5234415762,,2017,1716404,Finance,Investment Managers
JHI,John Hancock Investors Trust Common Stock,$18.14 ,-0.092,-0.51%,157945434,United States,,4576,,
JHS,John Hancock Income Securities Trust Common Stock,$16.04 ,-0.02,-0.13%,186811207,United States,,14073,,
JHX,James Hardie Industries plc American Depositary Shares (Ireland),$32.06 ,-0.02,-0.06%,14240009697,Ireland,,28006,Capital Goods,Building Materials
JIH,Juniper Industrial Holdings Inc. Class A Common Stock,$13.36 ,-0.08,-0.60%,576150000,,2019,379908,Finance,Business Services
JILL,J. Jill Inc. Common Stock,$4.82 ,-0.01,-0.21%,46367677,,2017,789709,Consumer Non-Durables,Apparel
JJSF,J & J Snack Foods Corp. Common Stock,$155.35 ,-3.13,-1.98%,2948486608,United States,1986,82982,Consumer Non-Durables,Specialty Foods
JKHY,Jack Henry & Associates Inc. Common Stock,$146.24 ,0.6,0.41%,11125539819,United States,1985,1157976,Technology,EDP Services
JKS,JinkoSolar Holding Company Limited American Depositary Shares (each representing 4 Common Shares),$63.87 ,-1.48,-2.27%,2892918136,China,2010,2479875,Technology,Semiconductors
JLL,Jones Lang LaSalle Incorporated Common Stock,$154.86 ,-0.86,-0.55%,7944766939,United States,,282326,Finance,Real Estate
JLS,Nuveen Mortgage and Income Fund,$20.34 ,-0.0565,-0.28%,111633736,United States,2009,10819,,
JMIA,Jumia Technologies AG American Depositary Shares each representing two Ordinary Shares,$61.82 ,-0.61,-0.98%,5514136223,,2019,4683774,Consumer Services,Catalog/Specialty Distribution
JMM,Nuveen Multi-Market Income Fund (MA),$7.21 ,-0.03,-0.41%,68223544,United States,,19642,,
JMP,JMP Group LLC Common Shares,$4.78 ,0.0999,2.14%,94001260,United States,2007,14405,Finance,Investment Bankers/Brokers/Service
JMPNL,JMP Group LLC 7.25% Senior Notes due 2027,$25.15 ,0.0999,0.40%,0,United States,,1310,Finance,Investment Bankers/Brokers/Service
JMPNZ,JMP Group LLC 6.875% Senior Notes due 2029,$24.35 ,0.1,0.41%,0,United States,,1385,Finance,Investment Bankers/Brokers/Service
JNCE,Jounce Therapeutics Inc. Common Stock,$11.45 ,-0.16,-1.38%,456299389,United States,2017,138379,Health Care,Biotechnology: Biological Products (No Diagnostic Substances)
JNJ,Johnson & Johnson Common Stock,$165.07 ,-1.51,-0.91%,4.34554E+11,United States,,5651190,Health Care,Major Pharmaceuticals
JNPR,Juniper Networks Inc. Common Stock,$24.45 ,-0.8,-3.17%,8062054344,United States,1999,8219466,Technology,Computer Communications Equipment
JOB,GEE Group Inc. Common Stock,$1.74 ,0.12,7.41%,30740794,United States,,443293,Technology,Diversified Commercial Services
JOBS,51job Inc. American Depositary Shares,$69.63 ,-0.44,-0.63%,4693099391,China,2004,164664,Technology,Diversified Commercial Services
JOE,St. Joe Company (The) Common Stock,$53.45 ,-0.23,-0.43%,3147272244,United States,,237834,Consumer Services,Homebuilding
JOF,Japan Smaller Capitalization Fund Inc Common Stock,$9.29 ,-0.07,-0.75%,263221866,United States,1990,60393,,
JOFFU,JOFF Fintech Acquisition Corp. Unit,$10.51 ,0.01,0.10%,0,United States,2021,216679,Finance,Business Services
JOUT,Johnson Outdoors Inc. Class A Common Stock,$123.35 ,-2.07,-1.65%,1247336416,United States,,19024,Consumer Non-Durables,Recreational Products/Toys
JP,Jupai Holdings Limited American Depositary Shares each representing six ordinary shares,$3.81 ,0.6,18.69%,128451548,,2015,400047,Consumer Services,Other Consumer Services
JPC,Nuveen Preferred & Income Opportunities Fund,$9.21 ,-0.06,-0.65%,951900922,United States,2003,279360,,
JPI,Nuveen Preferred and Income Term Fund Common Shares of Beneficial Interest,$24.20 ,-0.04,-0.17%,550825662,,2012,68006,,
JPM,JP Morgan Chase & Co. Common Stock,$144.65 ,3.4,2.41%,4.41096E+11,United States,,12124142,Finance,Major Banks
JPM^C,J P Morgan Chase & Co Depositary Shares each representing a 1/400th interest in a share of 6.00% Non-Cumulative  Preferred Stock Series EE,$27.02 ,-0.16,-0.59%,,United States,,209123,,
JPM^D,J P Morgan Chase & Co Depositary Shares each representing a 1/400th  interest in a share of 5.75% Non-Cumulative  Preferred Stock Series DD,$26.59 ,-0.23,-0.86%,,United States,,157131,,
JPM^G,J P Morgan Chase & Co Depositary Shares each representing a 1/400th interest in a share of 6.10% Non-Cumulative Preferred Stock Series AA,$25.56 ,-0.07,-0.27%,,United States,,99804,,
JPM^H,J P Morgan Chase & Co Depositary Shares each representing a 1/400th interest in a share of 6.15% Non-Cumulative Preferred Stock Series BB,$25.50 ,-0.12,-0.47%,,United States,,88747,Finance,Major Banks
JPM^J,J P Morgan Chase & Co Depositary Shares each representing a 1/400th interest in a share of JPMorgan Chase & Co. 4.75% Non-Cumulative Preferred Stock Series GG,$25.86 ,-0.23,-0.88%,,United States,,144573,Finance,Major Banks
JPS,Nuveen Preferred & Income Securities Fund,$9.51 ,-0.02,-0.21%,1937946545,United States,2002,483167,,
JPT,Nuveen Preferred and Income 2022 Term Fund Common Shares of Beneficial Interest,$24.42 ,-0.13,-0.53%,167012776,United States,2017,14088,,
JQC,Nuveen Credit Strategies Income Fund Shares of Beneficial Interest,$6.35 ,-0.07,-1.09%,861118992,United States,2003,974597,,
JRI,Nuveen Real Asset Income and Growth Fund Common Shares of Beneficial Interest,$14.18 ,-0.07,-0.49%,389512972,United States,2012,130541,,
JRJC,China Finance Online Co. Limited American Depositary Shares,$15.75 ,1.47,10.29%,38460870,China,2004,160705,Finance,Investment Bankers/Brokers/Service
JRO,Nuveen Floating Rate Income Opportuntiy Fund Shares of Beneficial Interest,$9.16 ,-0.11,-1.19%,371357557,United States,2004,875395,,
JRS,Nuveen Real Estate Income Fund Common Shares of Beneficial Interest,$9.14 ,0.14,1.56%,264077185,United States,2001,81597,,
JRSH,Jerash Holdings (US) Inc. Common Stock,$6.15 ,0.18,3.02%,69648750,United States,2018,25754,Consumer Non-Durables,Apparel
JRVR,James River Group Holdings Ltd. Common Shares,$50.06 ,-1.9,-3.66%,1532344259,Bermuda,2014,203405,Finance,Property-Casualty Insurers
JSD,Nuveen Short Duration Credit Opportunities Fund Common Shares of Beneficial Interest,$13.66 ,-0.06,-0.44%,137769952,United States,2011,59568,,
JSM,Navient Corporation 6% Senior Notes due December 15 2043,$24.01 ,-0.1427,-0.59%,0,United States,,20763,Finance,Finance: Consumer Services
JT,Jianpu Technology Inc. American depositary shares,$3.94 ,-0.6,-13.22%,83268697,,2017,1601574,Technology,Computer Software: Programming Data Processing
JTA,Nuveen Tax-Advantaged Total Return Strategy Fund Common Share of Beneficial Interest,$10.09 ,0.05,0.50%,139755551,United States,2004,34440,,
JTD,Nuveen Tax-Advantaged Dividend Growth Fund Common Shares of Beneficial Interest,$14.38 ,0,0.00%,208284809,United States,,53814,,
JUPW,Jupiter Wellness Inc. Common Stock,$7.02 ,-0.53,-7.02%,64459978,United States,2020,742145,Consumer Non-Durables,Package Goods/Cosmetics
JUPWW,Jupiter Wellness Inc. Warrant,$1.30 ,-0.1,-7.14%,0,United States,2020,6561,Consumer Non-Durables,Package Goods/Cosmetics
JVA,Coffee Holding Co. Inc. Common Stock,$5.27 ,-0.13,-2.41%,30084317,United States,2005,112032,Consumer Non-Durables,Packaged Foods
JW/A,John Wiley & Sons Inc.,$53.12 ,0.01,0.02%,,United States,,234371,,
JW/B,John Wiley & Sons Inc.,$52.56 ,0.7133,1.38%,,United States,,132,,
JWN,Nordstrom Inc. Common Stock,$36.08 ,1.23,3.53%,5689221329,United States,,3450945,Consumer Services,Clothing/Shoe/Accessory Stores
JWS,Jaws Acquisition Corp. Class A Ordinary Shares,$15.47 ,-0.54,-3.37%,1334287500,,2020,1067457,Health Care,Medical/Nursing Services
JYAC,Jiya Acquisition Corp. Class A Common Stock,$10.70 ,0.05,0.47%,146879328,United States,2020,47810,Finance,Business Services
JYNT,The Joint Corp. Common Stock,$37.70 ,-0.12,-0.32%,529351204,United States,2014,150799,Miscellaneous,Multi-Sector Companies
K,Kellogg Company Common Stock,$56.86 ,-0.52,-0.91%,19543519815,United States,,3418758,Consumer Non-Durables,Packaged Foods
KAI,Kadant Inc Common Stock,$147.20 ,-3.06,-2.04%,1694207232,United States,,44212,Technology,Industrial Machinery/Components
KAIRU,Kairos Acquisition Corp. Unit,$10.51 ,-0.04,-0.38%,0,United States,2021,23262,Finance,Business Services
KALA,Kala Pharmaceuticals Inc. Common Stock,$9.48 ,0.85,9.85%,531447520,United States,2017,3372107,Health Care,Major Pharmaceuticals
KALU,Kaiser Aluminum Corporation Common Stock,$110.90 ,2.28,2.10%,1753569542,United States,,94419,Capital Goods,Metal Fabrications
KALV,KalVista Pharmaceuticals Inc. Common Stock,$42.10 ,-0.47,-1.10%,755365189,United Kingdom,2015,1067719,Health Care,Major Pharmaceuticals
KAMN,Kaman Corporation Common Stock,$55.16 ,-0.82,-1.47%,1526684998,United States,,79260,Capital Goods,Military/Government/Technical
KAR,KAR Auction Services Inc Common Stock,$18.46 ,-0.73,-3.80%,2385983650,United States,2009,2394085,Consumer Durables,Automotive Aftermarket
KB,KB Financial Group Inc,$40.37 ,-0.55,-1.34%,15931388104,South Korea,,169435,Finance,Commercial Banks
KBAL,Kimball International Inc. Class B Common Stock,$12.07 ,0.23,1.94%,445164678,United States,,652197,Consumer Durables,Home Furnishings
KBH,KB Home Common Stock,$41.47 ,-2.59,-5.88%,4095663789,United States,1986,1608300,Capital Goods,Homebuilding
KBNT,Kubient Inc. Common Stock,$11.09 ,3.5,46.11%,130375249,United States,2020,9899855,Technology,EDP Services
KBNTW,Kubient Inc. Warrant,$5.20 ,2.42,87.05%,0,United States,2020,749104,Technology,EDP Services
KBR,KBR Inc. Common Stock,$32.13 ,0.21,0.66%,4579394213,United States,2006,985099,Basic Industries,Military/Government/Technical
KBSF,KBS Fashion Group Limited Common Stock,$5.13 ,0.13,2.60%,13293364,China,2013,351870,Consumer Non-Durables,Apparel
KC,Kingsoft Cloud Holdings Limited American Depositary Shares,$69.78 ,-0.57,-0.81%,15213279711,China,2020,1198398,Technology,Computer Software: Prepackaged Software
KCAPL,KCAP Financial Inc. 6.125% Notes due 2022,$25.83 ,0.33,1.29%,0,United States,,4837,,
KDMN,Kadmon Holdings Inc. Common Stock,$4.67 ,0.03,0.65%,800965453,United States,,4883130,Health Care,Major Pharmaceuticals
KDNY,Chinook Therapeutics Inc. Common Stock,$15.36 ,0.52,3.50%,647553516,United States,2015,123217,Health Care,Major Pharmaceuticals
KDP,Keurig Dr Pepper Inc. Common Stock,$31.42 ,-0.35,-1.10%,44215898497,United States,,3840140,Consumer Non-Durables,Beverages (Production/Distribution)
KE,Kimball Electronics Inc. Common Stock,$24.48 ,-0.07,-0.29%,610948853,United States,,189505,Technology,Electrical Products
KELYA,Kelly Services Inc. Class A Common Stock,$21.02 ,-0.07,-0.33%,826017895,United States,,81216,Technology,Professional Services
KELYB,Kelly Services Inc. Class B Common Stock,$21.33 ,-0.16,-0.75%,838199891,United States,,892,Technology,Professional Services
KEN,Kenon Holdings Ltd. Ordinary Shares,$31.20 ,1.1005,3.66%,1680807096,Singapore,2015,2058,Public Utilities,Electric Utilities: Central
KEP,Korea Electric Power Corporation Common Stock,$10.65 ,-0.28,-2.56%,13673834840,South Korea,1994,156211,Public Utilities,Electric Utilities: Central
KEQU,Kewaunee Scientific Corporation Common Stock,$12.57 ,0.19,1.54%,34728358,United States,,3387,Capital Goods,Medical Specialities
KERN,Akerna Corp. Common Stock,$7.56 ,-0.27,-3.45%,106283825,United States,2018,2250170,Technology,EDP Services
KERNW,Akerna Corp Warrant,$2.88 ,0.145,5.31%,0,United States,2018,122600,Technology,EDP Services
KEX,Kirby Corporation Common Stock,$60.99 ,0.45,0.74%,3661778610,United States,,375803,Consumer Services,Marine Transportation
KEY,KeyCorp Common Stock,$19.79 ,0.72,3.78%,19310547670,United States,,7520087,Finance,Major Banks
KEY^I,KeyCorp Depositary Shares Each Representing a 1/40th Ownership Interest in a Share of Fixed-to-Floating Rate Perpetual Non-Cumulative Preferred Stock Series E,$27.85 ,-0.05,-0.18%,,United States,,84404,,
KEY^J,KeyCorp Depositary Shares each representing a 1/40th ownership interest in a share of Fixed Rate Perpetual Non-Cumulative Preferred Stock Series F,$26.40 ,-0.31,-1.16%,,United States,,22565,,
KEY^K,KeyCorp Depositary Shares each representing a 1/40th ownership interest in a share of Fixed Rate Perpetual Non-Cumulative Preferred Stock Series G,$26.87 ,-0.29,-1.07%,,United States,,42568,,
KEYS,Keysight Technologies Inc. Common Stock,$151.07 ,-2.41,-1.57%,28111789192,United States,2014,1033384,Capital Goods,Industrial Machinery/Components
KF,Korea Fund Inc. (The) New Common Stock,$44.04 ,-0.0924,-0.21%,221574885,United States,,13761,,
KFFB,Kentucky First Federal Bancorp Common Stock,$7.30 ,0.61,9.12%,60128020,United States,,19163,Finance,Savings Institutions
KFRC,Kforce Inc. Common Stock,$46.50 ,-0.13,-0.28%,1020957627,United States,1995,120957,Technology,Professional Services
KFS,Kingsway Financial Services Inc. Common Stock (DE),$4.62 ,0,0.00%,104925139,Canada,,5495,Finance,Property-Casualty Insurers
KFY,Korn Ferry Common Stock,$55.94 ,-0.58,-1.03%,3017286797,United States,1999,275856,Technology,Diversified Commercial Services
KGC,Kinross Gold Corporation Common Stock,$7.07 ,-0.31,-4.20%,8896888000,Canada,,20760997,Basic Industries,Precious Metals
KHC,The Kraft Heinz Company Common Stock,$35.36 ,-0.03,-0.09%,43231955220,United States,,6345372,Consumer Non-Durables,Packaged Foods
KIDS,OrthoPediatrics Corp. Common Stock,$52.12 ,1.44,2.84%,1019186847,United States,2017,113817,Health Care,Medical/Dental Instruments
KIM,Kimco Realty Corporation Common Stock,$17.63 ,-0.4,-2.22%,7625305439,United States,,5407355,Consumer Services,Real Estate Investment Trusts
KIM^L,Kimco Realty Corporation Class L Depositary Shares each of which represents a one-one thousandth fractional interest in a share of 5.125% Class L Cumulative Redeemable Preferred Stock liquidation preference $25000.00 per share,$25.72 ,-0.23,-0.89%,,United States,,17922,,
KIM^M,Kimco Realty Corporation Class M Depositary Shares each of which represents a one-one thousandth fractional interest in a share of 5.25% Class M Cumulative Redeemable Preferred Stock liquidation preference $25000.00 per share,$26.02 ,-0.29,-1.10%,,United States,,9990,,
KIN,Kindred Biosciences Inc. Common Stock,$5.28 ,0.08,1.54%,208518468,United States,2013,336714,Health Care,Major Pharmaceuticals
KINS,Kingstone Companies Inc. Common Stock,$7.36 ,-0.02,-0.27%,78569457,United States,,10282,Finance,Property-Casualty Insurers
KINZ,KINS Technology Group Inc. Class A Common Stock,$10.25 ,-0.05,-0.49%,353625000,United States,2021,35783,Finance,Business Services
KINZU,KINS Technology Group Inc. Unit,$11.03 ,-0.04,-0.36%,0,United States,2020,28735,Finance,Business Services
KINZW,KINS Technology Group Inc. Warrant,$1.70 ,0.04,2.41%,0,United States,2021,94975,Finance,Business Services
KIO,KKR Income Opportunities Fund Common Shares,$15.22 ,-0.09,-0.59%,309579594,,2013,115436,,
KIQ,Kelso Technologies Inc Ordinary Shares,$1.22 ,0.09,7.97%,57547505,Canada,,4099504,Capital Goods,Railroads
KIRK,Kirkland's Inc. COMMONSTOCK,$24.81 ,-1.08,-4.17%,353681337,United States,2002,525489,Consumer Services,Other Specialty Stores
KJUL,Innovator Russell 2000 Power Buffer ETF - July,$26.22 ,-0.0401,-0.15%,,,2020,7028,,
KKR,KKR & Co. Inc. Common Stock,$47.95 ,-0.26,-0.54%,27470254737,United States,,3033098,Finance,Investment Managers
KKR^A,KKR & Co. Inc. 6.75% Series A Preferred Stock,$25.70 ,-0.04,-0.16%,,United States,,15094,,
KKR^B,KKR & Co. Inc. 6.50% Series B Preferred Stock,$25.77 ,-0.14,-0.54%,,United States,,10616,,
KKR^C,KKR & Co. Inc. 6.00% Series C Mandatory Convertible Preferred Stock,$67.20 ,0.11,0.16%,,United States,,88362,,
KL,Kirkland Lake Gold Ltd. Common Shares,$37.05 ,-1.2,-3.14%,9893230938,,,2245652,Basic Industries,Precious Metals
KLAC,KLA Corporation Common Stock,$337.18 ,5.37,1.62%,51950890824,United States,1980,1395211,Capital Goods,Electronic Components
KLAQU,KL Acquisition Corp Unit,$10.54 ,0.03,0.29%,0,United States,2021,10301,Finance,Business Services
KLDO,Kaleido Biosciences Inc. Common Stock,$11.74 ,0.18,1.56%,491124198,United States,2019,455408,Health Care,Biotechnology: Biological Products (No Diagnostic Substances)
KLIC,Kulicke and Soffa Industries Inc. Common Stock,$51.03 ,2.53,5.22%,3167788647,Singapore,,1031376,Technology,Semiconductors
KLR,Kaleyra Inc. Common Stock,$16.00 ,0.18,1.14%,469209296,United States,2018,889515,Technology,EDP Services
KLXE,KLX Energy Services Holdings Inc. Common Stock,$13.59 ,0.29,2.18%,115652504,United States,,76123,Energy,Oilfield Services/Equipment
KMB,Kimberly-Clark Corporation Common Stock,$130.24 ,-1.89,-1.43%,44068517462,United States,,2960353,Consumer Durables,Containers/Packaging
KMDA,Kamada Ltd. Ordinary Shares,$7.00 ,0.02,0.29%,313200741,Israel,2013,255570,Health Care,Major Pharmaceuticals
KMF,Kayne Anderson NextGen Energy & Infrastructure Inc.,$6.45 ,0.02,0.31%,304423630,,2010,180925,,
KMI,Kinder Morgan Inc. Common Stock,$15.04 ,0.2,1.35%,34057331309,United States,2011,17242384,Public Utilities,Natural Gas Distribution
KMPH,KemPharm Inc. Common Stock,$10.89 ,1.57,16.85%,126877038,United States,,4184699,Health Care,Major Pharmaceuticals
KMPR,Kemper Corporation,$74.19 ,-1.78,-2.34%,4856083080,United States,,335041,Finance,Property-Casualty Insurers
KMT,Kennametal Inc. Common Stock,$37.97 ,0.7,1.88%,3171748124,United States,,451888,Capital Goods,Industrial Machinery/Components
KMX,CarMax Inc,$122.36 ,-2.74,-2.19%,19888571944,United States,,1181576,Consumer Durables,Automotive Aftermarket
KN,Knowles Corporation Common Stock,$20.99 ,0.04,0.19%,1925336611,,2014,794436,Consumer Non-Durables,Consumer Electronics/Appliances
